,English text,en_fr_yandex_tr,fr_en_yandex_tr,correct_translation
87,What do we think?,Que pensons-nous?,What do we think?,True
88,What do you listen to?,Qu'écoutez-vous?,What are you listening to?,False
89,What do you remember?,Que vous rappelez-vous?,What do you remember?,True
90,What do you advise?,Que conseillez-vous?,What do you suggest?,False
91,What do I have?,Que dois-je?,What should I do?,False
92,What do they need?,De quoi ont-ils besoin?,What do they need?,True
93,What do you learn?,Qu'apprenez-vous?,What do you learn?,True
94,Who do you see?,Qui voyez-vous?,Who do you see?,True
95,What do you eat?,Que voulez-vous manger?,What would you like to eat?,False
96,What do I feel?,Comment je me sens?,How am I feeling?,False
97,What do you give me?,Que voulez-vous me donner?,What do you want to give me?,False
98,What do you mean?,Que voulez-vous dire?,What do you mean?,True
99,What do you want?,Que voulez-vous?,What do you want?,True
100,What do you sell?,Que voulez-vous vendre?,What do you want to sell?,False
101,What do we see?,Que voyons-nous?,What do we see?,True
102,What do you get?,Qu'obtenez-vous?,What do you get?,True
103,What do I see?,Que vois-je?,What do I see?,True
104,What do you understand?,Qu'entendez-vous?,What do you hear?,False
105,What do they say?,Que disent-ils?,What are they saying?,False
106,What do I win?,Que dois-je gagner?,What should I win?,False
107,What do you offer?,Que proposez vous?,What do you propose?,False
108,What do we have?,Qu'avons-nous?,What have we got?,False
109,What do we get?,Qu'obtenons-nous?,What do we get?,True
110,What do you feel?,Que ressentez-vous?,How do you feel?,False
111,What do you do?,Que faites-vous?,What do you do?,True
112,What do we know?,Que savons-nous?,What do we know?,True
113,What do you know?,Que savez-vous?,What do you know?,True
114,What do you say?,Qu'en dites-vous?,What do you think?,False
115,What do you drink?,Que voulez-vous boire?,What would you like to drink?,False
116,What do you think?,Qu'en pensez-vous?,What do you think?,True
117,What are you afraid of?,De quoi avez-vous peur?,What are you afraid of?,True
118,What do you mean?,Que voulez-vous dire?,What do you mean?,True
119,Why do we try?,Pourquoi essayons-nous?,Why are we trying?,False
120,How do you answer?,Comment pouvez-vous répondre?,How can you answer?,False
121,How do I decide?,Comment puis-je décider?,How do I decide?,True
122,Where do we stand?,Où en sommes-nous?,Where are we?,False
123,When do I leave?,Quand dois-je partir?,When do I leave?,True
124,How do I help you?,Comment puis-je vous aider?,How can I help you?,False
125,Why do you stay?,Pourquoi restez-vous?,Why are you staying?,False
126,Why do you stop?,Pourquoi avez-vous l'arrêter?,Why did you stop him?,False
127,When do we eat?,Quand allons-nous manger?,When are we going to eat?,False
128,When do I go?,Quand dois-je aller?,When should I go?,False
129,How do we continue?,Comment pouvons-nous continuer?,How can we go on?,False
130,Where's the money?,Où est l'argent?,Where's the money?,True
131,Where is the manager?,Où est le gestionnaire?,Where's the manager?,False
132,Where's the key?,Où est la clé?,Where's the key?,True
133,Where's the kitchen?,Où est la cuisine?,Where's the kitchen?,True
134,Where's the shower?,Où est la douche?,Where's the shower?,True
135,How is the lunch?,Comment est le déjeuner?,How's lunch?,False
136,Where's the hospital?,Où est l'hôpital?,Where's the hospital?,True
137,How is the baby?,Comment est le bébé?,How's the baby?,False
138,Where is the calculator?,Où est la calculatrice?,Where's the calculator?,False
139,Where is the umbrella?,Où est le parapluie?,Where's the umbrella?,False
140,Where is the pen?,Où est la plume?,Where's the feather?,False
141,Where is the phone?,Où est le téléphone?,Where's the phone?,False
142,Why does he hide?,Pourquoi fait-il le cacher?,Why is he hiding it?,False
143,Where does he do sport?,Où veut-il faire du sport?,Where does he want to play sports?,False
144,When does he arrive?,Quand est-il arrivé?,When did he get here?,False
145,Where's the kettle?,Où est la bouilloire?,Where's the kettle?,True
146,Where does it begin?,Par où commencer?,Where do I start?,False
147,Where does he live?,Où vit-il?,Where does he live?,True
148,When does he come?,Quand vient-il?,When is he coming?,False
149,When does she sleep?,Quand est-elle dormir?,When did she sleep?,False
150,Why does she sing?,Pourquoi fait-elle chanter?,Why is she blackmailing?,False
151,Why does she study?,Pourquoi fait-elle de l'étude?,Why does she study?,True
152,When does she smile?,Quand fait-elle sourire?,When does she smile?,True
153,Do you promise me?,Promettez-vous de moi?,Do you promise me?,True
154,How do you like your room?,Comment aimez-vous votre chambre?,How do you like your room?,True
155,How do you spell your name?,Comment voulez-vous épeler votre nom?,How do you spell your name?,True
156,How do you like my dress?,Comment aimez-vous ma robe?,How do you like my dress?,True
157,How do you learn new words?,Comment pouvez-vous apprendre de nouveaux mots?,How can you learn new words?,False
158,Where do I put my coat?,Où dois-je mettre mon manteau?,Where should I put my coat?,False
159,Where do you park your car?,Où avez-vous garer votre voiture?,Where did you park your car?,False
160,Do you love them?,Avez-vous aimer?,Did you like it?,False
161,Do they understand it?,Font-ils le comprendre?,Do they make it clear?,False
162,Do they remember me?,Se souviennent-ils de moi?,Do they remember me?,True
163,How do you work?,Comment travaillez-vous?,How do you work?,True
164,Do they love him?,Font-ils l'amour de lui?,Do they love him?,True
165,Do they learn it?,Ils l'apprennent?,They find out?,False
166,Do you forgive me?,- Vous me pardonner?,- You forgive me?,False
167,How do you like my beard?,Comment aimez-vous ma barbe?,How do you like my beard?,True
168,How do you spell his name?,Comment voulez-vous épeler son nom?,How do you spell his name?,True
169,How do you spend your time?,Comment passez-vous votre temps?,How do you spend your time?,True
170,How do you go to school?,Comment voulez-vous aller à l'école?,How do you want to go to school?,False
171,How do you save money?,Comment voulez-vous économiser de l'argent?,How do you want to save money?,False
172,Why do you have his picture?,Pourquoi avez-vous de son image?,Why do you have his picture?,True
173,Where do I find my baggage?,Où puis-je trouver mes bagages?,Where can I find my luggage?,False
174,How do you tell your boss?,Comment tu le dis à ton patron?,How do you tell your boss?,True
175,When do you do your homework?,Quand faites-vous vos devoirs?,When do you do your homework?,True
176,Where do I send my bill?,Où dois-je envoyer ma facture?,Where do I send my invoice?,False
177,How do you open your door?,Comment voulez-vous ouvrir votre porte?,How do you want to open your door?,False
178,Why do you talk to her?,Pourquoi parlez-vous de lui?,Why are you talking about him?,False
179,Do you want some cake?,Voulez-vous un gâteau?,Would you like a cake?,False
180,Where do you start your journey?,Où voulez-vous commencer votre voyage?,Where do you want to start your journey?,False
181,How do you like my shirt?,Comment aimez-vous ma chemise?,How do you like my shirt?,True
182,Why don't you try?,Pourquoi n'essayez-vous pas?,Why don't you try?,True
183,Why don't you give him a chance?,Pourquoi tu ne lui donnes pas une chance?,Why don't you give him a chance?,True
184,"Who is your boss, by the way?","Qui est votre patron, par la voie?","Who's your boss, by the way?",False
185,"What's your name, by the way?","Quel est votre nom, au fait?","What's your name, by the way?",True
186,"What's his name, by the way?","Quel est son nom, par le chemin?","What's his name, by the way?",True
187,Why don't you wear your new suit?,Pourquoi tu ne Portes pas ton nouveau costume?,Why don't you wear your new suit?,True
188,What date is it today?,Quelle date est-il aujourd'hui?,What date is it today?,True
189,What day is it today?,Quel jour est-ce aujourd'hui?,What day is it today?,True
190,Is it cold in your room?,Il fait froid dans votre chambre?,Is it cold in your room?,True
191,How often do you go to the dentist?,Combien de fois avez-vous aller chez le dentiste?,How many times have you gone to the dentist?,False
192,Do you know about the discount?,Savez-vous à propos de la réduction?,Do you know about the discount?,True
193,What do you do at weekends?,Que faites-vous le week-end?,What do you do on weekends?,False
194,What do you know about physics?,Que savez-vous au sujet de la physique?,What do you know about physics?,True
195,What do I know about computers?,Qu'est-ce que je connais aux ordinateurs?,What do I know about computers?,True
196,What do you have against dogs?,Qu'avez-vous contre les chiens?,What do you have against dogs?,True
197,Is she famous in your country?,Est-elle célèbre dans votre pays?,Is she famous in your country?,True
198,Is it bad for your health?,Est-il mauvais pour votre santé?,Is it bad for your health?,True
199,Is it sunny in your city?,Est-il ensoleillé dans votre ville?,Is it Sunny in your city?,False
200,Does he know about the show?,Ne sait-il à propos de l'émission?,Doesn't he know about the show?,False
201,What do you do for clients?,Que faites-vous pour les clients?,What do you do for customers?,False
202,How come you don't like him?,Comment venir vous n'avez pas comme lui?,How come you don't like him?,True
203,How come you don't believe me?,Comment pouvez-vous ne me croyez pas?,How can you not believe me?,False
204,What do you think about kids?,Que pensez-vous des enfants?,What do you think of the children?,False
205,What do you do on Wednesdays?,Que faites-vous de mercredi?,What about Wednesday?,False
206,What do you know about animals?,Que connaissez-vous les animaux?,What do you know about animals?,True
207,Why don't you talk about the problem?,Pourquoi tu ne parles pas du problème?,Why don't you talk about the problem?,True
208,Why don't they come?,Pourquoi n'ont-ils pas venus?,Why didn't they come?,False
209,Why don't we go there?,Pourquoi ne pas y aller?,Why don't you go?,False
210,Why don't you visit me?,Pourquoi tu ne viens pas me voir?,Why don't you come to me?,False
211,Why don't you tell them the truth?,Pourquoi ne pas leur dire la vérité?,Why not tell them the truth?,False
212,How often do you go to the library?,Combien de fois allez-vous à la bibliothèque?,How many times do you go to the library?,False
213,How often do you go to the cinema?,À quelle fréquence allez-vous au cinéma?,How often do you go to the movies?,False
214,How often do you go to the gym?,Combien de fois avez-vous aller à la gym?,How many times have you gone to the gym?,False
0,He does not need help.,Il n'a pas besoin d'aide.,He doesn't need any help.,False
1,It doesn't mean anything.,Cela ne veut pas dire quoi que ce soit.,It doesn't mean anything.,True
2,He doesn't want anything.,Il ne veut pas que quoi que ce soit.,He doesn't want anything.,True
3,It doesn't show anything.,Il ne veut pas montrer quoi que ce soit.,It doesn't show anything.,True
4,He doesn't know anything.,Il ne sait rien.,He knows nothing.,False
5,It doesn't change anything.,Ça ne change rien.,It doesn't matter.,False
6,He doesn't say anything.,Il ne veut rien dire.,He means nothing.,False
7,I do not think so.,Je ne le crois pas.,I don't believe that.,False
8,We don't know yet.,Nous ne savons pas encore.,We don't know yet.,True
9,You don't live here.,Tu ne vis pas ici.,You don't live here.,True
10,We don't think so.,Nous ne le pensons pas.,We don't think so.,True
11,I don't know much about it.,Je ne sais pas beaucoup sur elle.,I don't know much about her.,False
12,I don't understand it.,Je ne le comprends pas.,I don't understand.,False
13,I don't trust him.,Je n'ai pas confiance en lui.,I don't trust him.,True
14,I don't understand you.,Je ne te comprends pas.,I don't understand you.,True
15,I don't see it.,Je ne la vois pas.,I don't see it.,True
16,They do not remember him.,Ils ne se souviennent pas de lui.,They don't remember him.,False
17,I don't want it.,Je ne veux pas ça.,I don't want that.,False
18,You don't answer me.,Vous ne répondez pas à moi.,You're not answering me.,False
19,You don't trust me.,Vous n'avez pas confiance en moi.,You don't trust me.,True
20,You don't mean it.,Vous n'êtes pas sérieux.,You can't be serious.,False
21,I don't know you!,Je ne vous connais pas!,I don't know you!,True
22,I don't know it!,Je ne sais pas elle!,I don't know her!,False
23,We don't have it.,Nous ne l'avons pas.,We don't have it.,True
24,They don't believe me.,Ils ne me croyez pas.,They don't believe me.,True
25,I don't believe her.,Je ne la crois pas.,I don't believe her.,True
26,I don't remember it,Je ne m'en souviens pas,I don't remember,False
27,I don't see her.,Je ne la vois pas.,I don't see it.,False
28,You don't need her.,Vous n'avez pas besoin d'elle.,You don't need her.,True
29,I don't hate her.,Je ne suis pas à la haïr.,I'm not hating.,False
30,You don't like it.,Vous ne l'aimez pas.,You don't like him.,False
31,I don't agree.,Je ne suis pas d'accord.,I do not agree.,False
32,I don't help her.,Je n'ai pas l'aider.,I didn't help him.,False
33,I don't understand him.,Je ne le comprends pas.,I don't understand.,False
34,I do not want it.,Je ne veux pas de ça.,I don't want that.,False
35,You don't remember me.,Vous ne vous souvenez pas de moi.,You don't remember me.,True
36,I don't love him.,Je ne l'aime pas.,I don't like him.,False
37,We don't use it.,Nous ne l'utilisons pas.,We don't use it.,True
38,They don't like it.,Ils ne l'aiment pas.,They don't like him.,False
39,You don't know her.,Vous ne la connaissez pas.,You don't know.,False
40,I do not believe him.,Je ne crois pas en lui.,I don't believe in him.,False
41,You don't know them.,Vous ne les connaissez pas.,You don't know.,False
42,You don't believe me.,Vous ne me croyez pas.,You don't believe me.,True
43,You don't love him.,Vous ne l'aimez pas.,You don't like him.,False
44,I don't know it.,Je ne sais pas elle.,I don't know her.,False
45,I don't see them.,Je ne les vois pas.,I don't see them.,True
46,They do not love him.,Ils ne l'aiment pas.,They don't like him.,False
47,You don't feel it.,Vous ne le sentez pas.,You don't feel it.,True
48,I don't understand myself.,Je ne comprends pas moi-même.,I don't understand myself.,True
49,We don't know you.,Nous ne vous connaissent pas.,We don't know you.,True
50,I don't remember you.,Je ne me souviens pas de vous.,I don't remember you.,True
51,You don't help me.,Vous ne m'aidez pas.,You're not helping me.,False
52,They don't know you.,Ils ne vous connaissent pas.,They don't know you.,True
53,They don't have it.,Ils ne l'ont pas.,They don't have it.,True
54,You don't see it.,Vous ne le voyez pas.,You don't see it.,True
55,I do not like it.,Je n'aime pas ça.,I don't like it.,False
56,I don't remember her.,Je ne me souviens pas de son.,I don't remember her.,True
57,You don't know him!,Vous ne savez pas lui!,You don't know him!,True
58,I do not believe you.,Je ne vous crois pas.,I don't believe you.,False
59,You do not love me.,Vous ne m'aimez pas.,You don't like me.,False
60,I do not understand you.,Je ne vous comprends pas.,I don't understand you.,False
61,They don't call me.,On ne m'appelle pas.,No one's calling me.,False
62,I do not trust you.,Je n'ai pas confiance en vous.,I don't trust you.,False
63,They don't see me.,Ils ne me voient pas.,They can't see me.,False
64,I don't need a doctor.,Je n'ai pas besoin d'un médecin.,I don't need a doctor.,True
65,I don't need a shower.,Je n'ai pas besoin d'une douche.,I don't need a shower.,True
66,I don't want any problems.,Je ne veux pas de problèmes.,I don't want any trouble.,False
67,I don't need a job.,Je n'ai pas besoin d'un emploi.,I don't need a job.,True
68,You don't have a girlfriend.,Vous n'avez pas de petite amie.,You don't have a girlfriend.,True
69,I don't like this question.,Je n'aime pas cette question.,I don't like that question.,False
70,I don't have a plan.,Je n'ai pas de plan.,I don't have a plan.,True
71,We don't have any choice.,Nous n'avons pas le choix.,We have no choice.,False
72,I don't understand the question.,Je ne comprends pas la question.,I don't understand the question.,True
73,We don't have a choice,Nous n'avons pas le choix,We have no choice.,False
74,I don't like this game.,Je n'aime pas ce jeu.,I don't like this game.,True
75,I don't have a husband.,Je n'ai pas de mari.,I don't have a husband.,True
76,I don't like this place.,Je n'aime pas cet endroit.,I don't like this place.,True
77,I don't have a list.,Je n'ai pas de liste.,I don't have a list.,True
78,I don't have a job.,Je n'ai pas de travail.,I don't have a job.,True
79,You don't have a chance.,Vous n'avez pas de chance.,You're out of luck.,False
80,I don't have an answer.,Je n'ai pas de réponse.,I have no answer.,False
81,You don't have a car.,Vous n'avez pas de voiture.,You don't have a car.,True
82,I don't have a problem.,Je n'ai pas de problème.,I don't have a problem.,True
83,I don't have a son.,Je n'ai pas de fils.,I don't have a son.,True
84,I don't have a brother.,Je n'ai pas de frère.,I don't have a brother.,True
85,I don't have any cash.,Je n'ai pas de trésorerie.,I don't have any cash.,True
86,I don't have a father.,Je n'ai pas de père.,I don't have a father.,True
87,We don't have a choice.,Nous n'avons pas le choix.,We have no choice.,False
88,I don't have a gun.,Je n'ai pas de pistolet.,I don't have a gun.,True
89,I don't need another friend,Je n'ai pas besoin d'un autre ami,I don't need another friend,True
90,I don't wear a watch.,Je ne porte pas de montre.,I'm not wearing a watch.,False
91,I don't have a phone.,Je n'ai pas de téléphone.,I don't have a phone.,True
92,You don't need a coat.,Vous n'avez pas besoin d'un manteau.,You don't need a coat.,True
93,I don't have a daughter.,Je n'ai pas de fille.,I don't have a daughter.,True
94,You don't have any choice.,Vous n'avez pas le choix.,You have no choice.,False
95,I do not know the way.,Je ne sais pas le chemin.,I don't know the way.,False
96,I don't need any milk.,Je n'ai pas besoin du tout de lait.,I don't need milk at all.,False
97,You don't miss me.,Vous ne manquez pas de moi.,You don't miss me.,True
98,I don't have a key.,Je n'ai pas de clé.,I don't have a key.,True
99,I don't have a husband.,Je n'ai pas de mari.,I don't have a husband.,True
100,I don't like this book.,Je n'aime pas ce livre.,I don't like this book.,True
101,I don't have a pen.,Je n'ai pas de stylo.,I don't have a pen.,True
102,I don't have a mother.,Je n'ai pas de mère.,I don't have a mother.,True
103,I don't remember the name.,Je ne me souviens pas le nom.,I don't remember the name.,True
104,I don't have the time,Je n'ai pas le temps,I don't have time.,False
105,I don't like this house.,Je n'aime pas cette maison.,I don't like this house.,True
106,I don't need a doctor.,Je n'ai pas besoin d'un médecin.,I don't need a doctor.,True
107,I don't have a son.,Je n'ai pas de fils.,I don't have a son.,True
108,I don't need a dance.,Je n'ai pas besoin d'une danse.,I don't need a dance.,True
109,I don't understand this language,Je ne comprends pas cette langue,I don't understand that language.,False
110,You don't know a thing,Vous ne savez pas une chose,You don't know a thing,True
111,You don't have any questions.,Vous n'avez pas de questions.,You have no questions.,False
112,We don't have a minute.,Nous n'avons pas une minute.,We don't have a minute.,True
113,I don't say a word.,Je ne dis pas un mot.,I'm not saying a word.,False
114,I don't need a teacher.,Je n'ai pas besoin d'un professeur.,I don't need a teacher.,True
115,You don't need a reason,Vous n'avez pas besoin d'une raison,You don't need a reason,True
116,We don't need a reason,Nous n'avons pas besoin d'une raison,We don't need a reason,True
117,We don't have any money.,Nous n'avons pas d'argent du tout.,We have no money at all.,False
118,I don't feel any pain,Je ne ressens aucune douleur,I don't feel any pain,True
119,I don't need a computer,Je n'ai pas besoin d'un ordinateur,I don't need a computer,True
120,She doesn't need him,Elle n'a pas besoin de lui,She doesn't need him.,False
121,It doesn't surprise me,Ça ne m'étonne pas,I'm not surprised.,False
122,She doesn't believe me.,Elle ne me croyez pas.,She doesn't believe me.,True
123,It doesn't hurt me.,Il ne veut pas me faire de mal.,He doesn't want to hurt me.,False
124,He doesn't say it.,Il ne le dit pas.,He doesn't say.,False
125,He doesn't need you.,Il n'a pas besoin de vous.,He doesn't need you.,True
126,You don't need talent.,Vous n'avez pas besoin de talent.,You don't need talent.,True
127,You don't know anything.,Vous ne savez pas quoi que ce soit.,You don't know anything.,True
128,You don't do anything.,Vous n'avez pas à faire quoi que ce soit.,You don't have to do anything.,False
129,You don't eat meat.,Vous ne mangez pas de viande.,You don't eat meat.,True
130,I don't want tea.,Je ne veux pas de thé.,I don't want tea.,True
131,You don't know anyone.,Vous ne connaissez personne.,You don't know anyone.,True
132,I don't like coffee.,Je n'aime pas le café.,I don't like coffee.,True
133,I don't need help.,Je n'ai pas besoin d'aide.,I don't need help.,True
134,I don't want money.,Je ne veux pas d'argent.,I don't want any money.,False
135,I don't hear anything.,Je n'entends rien.,I can't hear a thing.,False
136,We don't have anything.,Nous n'avons pas de quoi que ce soit.,We don't have anything.,True
137,I don't need luck.,Je n'ai pas besoin de chance.,I don't need luck.,True
138,I don't feel anything.,Je ne ressens rien.,I don't feel anything.,True
139,You do not know maths.,Vous ne connaissez pas les maths.,You don't know math.,False
140,I don't need anyone!,Je n'ai pas besoin de personne!,I don't need anyone!,True
141,I don't watch TV.,Je ne regarde pas la TÉLÉ.,I don't watch TV.,True
142,I don't believe anyone.,Je ne crois pas que personne.,I don't think anyone.,False
143,I don't remember anything.,Je ne me souviens pas de quoi que ce soit.,I don't remember anything.,True
144,I don't need to work.,Je n'ai pas besoin de travailler.,I don't need to work.,True
145,You don't work at school.,Vous n'avez pas de travail à l'école.,You don't have a job at school.,False
146,I don't like tea.,Je n'aime pas le thé.,I don't like tea.,True
147,I don't take anything.,Je ne prends pas n'importe quoi.,I'm not taking anything.,False
148,You don't say anything.,Vous ne dites rien.,You say nothing.,False
149,You don't remember anything,Vous ne vous souvenez de rien,You don't remember anything,True
150,They don't agree.,Ils ne sont pas d'accord.,They don't agree.,True
151,You don't understand!,Vous ne comprenez pas!,You don't understand!,True
152,I don't move.,Je ne bouge pas.,I'm not going anywhere.,False
153,I don't believe!,Je ne crois pas!,I don't think so!,False
154,We don't speak.,Nous ne parlons pas.,We don't talk.,False
155,I don't understand!,Je ne comprends pas!,I don't understand!,True
156,They don't work.,Ils ne travaillent pas.,They don't work.,True
157,You don't dance.,Vous n'avez pas de danse.,You don't have a dance.,False
158,You don't drink.,Vous ne buvez pas.,You don't drink.,True
159,I don't smoke.,Je ne fume pas.,I don't smoke.,True
160,You don't talk.,Vous ne parlez pas.,You don't talk.,True
161,We don't dance.,Nous n'avons pas de danse.,We did not dance.,False
162,They don't understand.,Ils ne comprennent pas.,They don't understand.,True
163,We don't talk.,Nous ne parlons pas.,We don't talk.,True
164,I don't answer.,Je n'ai pas de réponse.,I have no answer.,False
165,I don't speak Italian.,Je ne parle pas l'italien.,I don't speak Italian.,True
166,We don't stop.,Nous ne nous arrêtons pas.,We don't stop.,True
167,I don't sing.,Je ne chante pas.,I don't sing.,True
168,We don't know!,Nous ne savons pas!,We don't know!,True
169,I don't want to eat.,Je ne veux pas manger.,I don't want to eat.,True
170,We don't know what to do.,Nous ne savons pas quoi faire.,We don't know what to do.,True
171,They don't look dangerous.,Ils n'ont pas l'air dangereux.,They don't look dangerous.,True
172,I don't feel good.,Je ne me sens pas bien.,I don't feel well.,False
173,I don't feel special.,Je ne me sens pas spéciale.,I don't feel special.,True
174,I don't go to the gym.,Je ne vais pas à la salle de gym.,I'm not going to the gym.,False
175,You don't look surprised.,Vous n'avez pas l'air surpris.,You don't look surprised.,True
176,You don't look good.,Vous n'avez pas l'air bien.,You don't look well.,False
177,You don't look happy.,Vous n'avez pas l'air heureux.,You don't look happy.,True
178,I don't know who to choose.,Je ne sais pas qui choisir.,I don't know who to pick.,False
179,I don't know what to believe.,Je ne sais pas quoi croire.,I don't know what to believe.,True
180,I do not know what to think.,Je ne sais pas quoi penser.,I don't know what to think.,False
181,He doesn't understand us.,Il ne nous comprennent pas.,They don't understand us.,False
182,It doesn't hurt him.,Il ne fait pas de mal de lui.,He doesn't hurt himself.,False
183,She doesn't remember him.,Elle ne se souvient pas de lui.,She doesn't remember him.,True
184,He does not call me.,Il ne m'appelez pas.,He's not calling me.,False
185,He doesn't help me.,Il ne m'aide pas.,He's not helping me.,False
186,She doesn't see me.,Elle ne me voit pas.,She can't see me.,False
187,She doesn't need it.,Elle n'en a pas besoin.,She doesn't need to.,False
188,He doesn't like me.,Il ne m'aime pas.,He doesn't like me.,True
189,He doesn't see me.,Il ne me voit pas.,He can't see me.,False
190,It doesn't surprise me.,Ça ne m'étonne pas.,I'm not surprised.,False
191,He doesn't visit you.,Il ne visite pas vous.,He's not visiting you.,False
192,She doesn't answer him.,Elle ne lui réponds pas.,She's not answering him.,False
