,English text,en_fr_yandex_tr,fr_en_yandex_tr,correct_translation
193,It doesn't matter.,Il n'a pas d'importance.,It doesn't matter.,True
194,It doesn't stop me.,Il n'arrête pas de moi.,He doesn't stop me.,False
195,She doesn't hate you.,Elle ne les déteste pas vous.,She doesn't hate you.,True
196,She doesn't explain me anything.,Elle ne veut pas m'expliquer quoi que ce soit.,She doesn't want to explain anything to me.,False
197,He does not call you.,Il ne vous appelle pas.,He's not calling you.,False
198,It is not right.,Il n'est pas droit.,He's not straight.,False
199,It doesn't make us happy.,Il ne nous rend pas heureux.,He doesn't make us happy.,False
200,He doesn't say no.,Il ne dit pas non.,He's not saying no.,False
201,He doesn't know her.,Il ne le sait pas elle.,He doesn't know she.,False
202,He doesn't interest me.,Il ne m'intéresse pas.,It does not interest me.,False
203,She doesn't love me.,Elle ne m'aime pas.,She doesn't like me.,False
204,He doesn't believe us.,Il ne nous croyez pas.,He doesn't believe us.,True
205,She doesn't see you.,Elle ne veut pas vous voir.,She doesn't want to see you.,False
206,She doesn't cook.,Elle ne cuisine pas.,She doesn't Cook.,False
207,He does not believe me.,Il ne me croyez pas.,He doesn't believe me.,False
208,It does not suit me.,Il ne me convient pas.,He doesn't suit me.,False
209,She does not love him.,Elle ne l'aime pas.,She doesn't like him.,False
210,He doesn't do it.,Il ne fait pas ça.,He doesn't do that.,False
211,It doesn't make me happy.,Cela ne me rend pas heureux.,It doesn't make me happy.,True
212,She doesn't see it.,Elle ne voit pas cela.,She doesn't see that.,False
213,She doesn't mean it.,Elle ne signifie pas qu'il.,It doesn't mean he.,False
214,She doesn't believe you.,Elle ne vous crois pas.,She doesn't believe you.,True
215,She doesn't see anybody.,Elle ne veut pas voir personne.,She doesn't want to see anyone.,False
216,He doesn't feel anything.,Il ne ressent rien.,He feels nothing.,False
217,He doesn't talk to anyone.,Il ne parle à personne.,He's not talking to anyone.,False
218,She doesn't hear anything.,Elle ne veut rien entendre.,She won't listen.,False
219,He doesn't need help.,Il n'a pas besoin d'aide.,He doesn't need any help.,False
220,She doesn't need money.,Elle n'a pas besoin d'argent.,She doesn't need money.,True
221,She doesn't like fun.,Elle n'aime pas amusant.,She doesn't like fun.,True
222,She doesn't like chocolate.,Elle n'aime pas le chocolat.,She doesn't like chocolate.,True
223,She doesn't use sugar.,Elle n'utilise pas de sucre.,She doesn't use sugar.,True
224,It doesn't look right.,Il ne regarde pas à droite.,He's not looking right.,False
225,He doesn't like pasta.,Il n'aime pas les pâtes.,He doesn't like pasta.,True
226,She doesn't like cheese!,Elle n'aime pas le fromage!,She doesn't like cheese!,True
227,He doesn't know anything.,Il ne sait rien.,He knows nothing.,False
228,She doesn't drink tea.,Elle ne boit pas de thé.,She doesn't drink tea.,True
229,He doesn't eat meat.,Il ne mange pas de viande.,He doesn't eat meat.,True
230,She doesn't remember anything.,Elle ne se rappelle de rien.,She doesn't remember anything.,True
231,I don't want to talk about it!,Je ne veux pas en parler!,I don't want to talk about it!,True
232,I don't want to be like you.,Je ne veux pas être comme vous.,I don't want to be like you.,True
233,I don't want to work with you.,Je ne veux pas travailler avec vous.,I don't want to work with you.,True
234,I don't want to worry about you.,Je ne veux pas vous soucier de vous.,I don't want to worry about you.,True
235,You don't want to study with her.,Tu ne veux pas étudier avec elle.,You don't want to study with her.,True
236,I do not want to tell her.,Je ne veux pas lui dire.,I don't want to tell him.,False
237,I don't want to sing with you.,Je n'ai pas envie de chanter avec vous.,I don't want to sing with you.,True
238,I don't want to go with them.,Je ne veux pas aller avec eux.,I don't want to go with them.,True
239,I don't want to read about it.,Je ne veux pas le lire.,I don't want to read it.,False
240,I don't want to know about it.,Je ne veux pas le savoir.,I don't want to know.,False
241,I don't want to live without you.,Je ne veux pas vivre sans toi.,I don't want to live without you.,True
242,I don't want to dance with you.,Je ne veux pas danser avec vous.,I don't want to dance with you.,True
243,It doesn't say anything to me.,Ca ne veut rien dire pour moi.,It means nothing to me.,False
244,She doesn't mean anything to me.,Elle ne signifie rien pour moi.,She means nothing to me.,False
245,It does not help him.,Il ne permet pas de lui.,He does not allow him.,False
246,We don't have time to travel.,Nous n'avons pas le temps de voyager.,We don't have time to travel.,True
247,I don't have time to dream.,Je n'ai pas le temps de rêver.,I don't have time to dream.,True
248,I don't know anything about those messages.,Je ne sais rien à propos de ces messages.,I don't know anything about those messages.,True
249,I don't usually make mistakes.,Je n'ai pas l'habitude de faire des erreurs.,I'm not used to making mistakes.,False
250,I don't know anything about any letters.,Je ne sais rien à propos de toutes les lettres.,I don't know anything about all the letters.,False
251,I'm sure she doesn't remember me.,Je suis sûr qu'elle ne se souvient pas de moi.,I'm sure she doesn't remember me.,True
252,I don't remember those people.,Je ne me souviens pas de ces gens.,I don't remember these people.,False
253,I'm not even sure that's possible.,Je ne suis même pas sûr que c'est possible.,I'm not even sure that's possible.,True
254,I'm not sure that's true.,Je ne suis pas sûr que ce soit vrai.,I'm not sure that's true.,True
255,I'm not sure that's safe.,Je ne suis pas sûr que c'est un coffre-fort.,I'm not sure it's a safe.,False
256,I don't usually have guests.,Je n'ai pas l'habitude d'avoir des invités.,I'm not used to having guests.,False
257,I do not often go to parties.,Je ne vais pas souvent à des fêtes.,I don't go to parties very often.,False
258,I don't think it's possible.,Je ne pense pas que c'est possible.,I don't think that's possible.,False
259,I don't think he's right.,Je ne pense pas qu'il a raison.,I don't think he's right.,True
260,I don't think it's important.,Je ne pense pas que c'est important.,I don't think that's important.,False
261,I don't think it's good.,Je ne pense pas que c'est bon.,I don't think that's good.,False
262,"Dorothy, we don't have much time.","Dorothy, nous n'avons pas beaucoup de temps.","Dorothy, we don't have much time.",True
263,I don't have anything to talk about.,Je n'ai rien d'en parler.,I have nothing to talk about.,False
264,You don't have your bag.,Vous n'avez pas votre sac.,You don't have your bag.,True
265,He doesn't like to answer questions.,Il n'aime pas répondre aux questions.,He doesn't like to answer questions.,True
266,She doesn't want to wear glasses.,Elle ne veut pas porter des lunettes.,She doesn't want to wear glasses.,True
267,They don't forgive and they don't forget.,Ils ne pardonnent pas et n'oublient pas.,They don't forgive and forget.,False
268,We don't know and we don't ask.,On ne sait pas et on ne demande pas.,We don't know and we don't ask.,True
269,I don't know and I don't want to know.,Je ne sais pas et je ne veux pas savoir.,"I don't know, and I don't want to know.",False
270,She's not here today.,Elle n'est pas là aujourd'hui.,She's not here today.,True
271,She isn't well today.,Elle n'est pas bien aujourd'hui.,She's not well today.,False
272,It doesn't really matter.,Il n'a pas vraiment d'importance.,It doesn't really matter.,True
273,You don't always agree with me.,Vous n'avez pas toujours d'accord avec moi.,You don't always agree with me.,True
274,I do not always agree with him.,Je ne suis pas toujours d'accord avec lui.,I don't always agree with him.,False
275,I don't always disagree with you!,Je ne suis pas toujours en désaccord avec vous!,I don't always disagree with you!,True
276,He doesn't like to play games.,Il n'aime pas jouer à des jeux.,He doesn't like to play games.,True
277,"Sorry, I'm really not hungry.","Désolé, je ne suis vraiment pas faim.","Sorry, I'm really not hungry.",True
278,"Sorry, I'm not usually late.","Désolé, je ne suis pas habituellement à la fin.","Sorry, I'm not usually at the end.",False
279,Sometimes I don't understand myself.,Parfois je ne comprends pas moi-même.,Sometimes I don't understand myself.,True
280,I'm sure he doesn't hate you.,Je suis sûr qu'il ne les déteste pas vous.,I'm sure he doesn't hate you.,True
281,I'm sure he doesn't like you.,Je suis sûr qu'il ne vous aime pas.,I'm sure he doesn't like you.,True
282,I don't have time for these games.,Je n'ai pas le temps pour ces jeux.,I don't have time for these games.,True
283,We don't usually worry about them.,Nous n'avons généralement pas l'inquiéter.,We don't usually have to worry him.,False
284,He doesn't want to talk to you.,Il ne veut pas vous parler.,He doesn't want to talk to you.,True
285,The weather is not always so bad.,La météo n'est pas toujours si mauvais.,The weather's not always that bad.,False
286,She is not usually so friendly.,Elle n'est généralement pas très amical.,She's not usually very friendly.,False
287,I don't agree with you.,Je ne suis pas d'accord avec vous.,I don't agree with you.,True
288,They don't have a cat.,Ils n'ont pas un chat.,They don't have a cat.,True
