ID,Page ID,Local text,English text,Mix 1,Correct 1,Mix 2,Correct 2,Mix 3,Correct 3,Mix 4,Correct 4,Mix 5,Correct 5,Mix 6,Correct 6,Mix 7,Correct 7,Mix 8,Correct 8,Mix 9,Correct 9,Mix 10,Correct 10
"70","190","Он хочет 10 миллионов долларов.","He wants 10 million dollars.","He, Him, His, It, Its","He","wants, want, wanting, wanted, wantest","wants","","10","million, millionth, millionaire","million","dollars, dolls, dollop, doll, dollar","dollars","",".","","","","","","","",""
"71","190","Это десять тысяч вещей.","It's ten thousand things.","It's, It'll, Its, This","It's","ten, tens, tened, tenning, tenned","ten","thousand, thousands, thousandth","thousand","things, thing, thung","things","",".","","","","","","","","","",""
"72","190","Он покупает пятьсот шаров.","He buys five hundred balloons.","He, Him, His, It, Its","He","buys, bought, buy, buying, buyest, buyed, buies","buys","five, fives, fived, fiving, fiveing","five","hundred, hundreds, hundreds'","hundred","balloons, balloon, ballooning, ballooned, balloons'","balloons","",".","","","","","","","",""
"73","190","Это двадцать пять миль.","It's twenty five miles.","It's, It'll, Its, This","It's","twenty, twenties, twentys, twentiest, twenties'","twenty","five, fives, fived, fiving, fiveing","five","miles, mile, miled","miles","",".","","","","","","","","","",""
"74","190","Это 12 миллионов фунтов.","It's 12 million pounds.","It's, It'll, Its, This","It's","","12","million, millionth, millionaire","million","pounds, pound, pounding, pounded","pounds","",".","","","","","","","","","",""
"75","190","Это пять тысяч долларов.","It's five thousand dollars.","It's, It'll, Its, This","It's","five, fives, fived, fiving, fiveing","five","thousand, thousands, thousandth","thousand","dollars, dolls, dollop, doll, dollar","dollars","",".","","","","","","","","","",""
"76","190","Это стоит десять тысяч фунтов.","It's ten thousand pounds.","It's, It'll, Its, This","It's","ten, tens, tened, tenning, tenned","ten","thousand, thousands, thousandth","thousand","pounds, pound, pounding, pounded","pounds","",".","","","","","","","","","",""
"77","190","Это 10 миллионов миль.","It's 10 million miles.","It's, It'll, Its, This","It's","","10","million, millionth, millionaire","million","miles, mile, miled","miles","",".","","","","","","","","","",""
"78","190","Это сто рублей.","It's one hundred rubles.","It's, It'll, Its, This","It's","one, once, first","one","hundred, hundreds, hundreds'","hundred","rubles, ruble, rubler, ruble's","rubles","",".","","","","","","","","","",""
"79","190","Там есть пять миллионов книг.","There are five million books.","There, Theres, Thered, Thering","There","are, is, be, been, was, were, will, shall","are","five, fives, fived, fiving, fiveing","five","million, millionth, millionaire","million","books, book, booked, booking, booker","books","",".","","","","","","","",""
"80","190","Это две тысячи долларов.","It's two thousand dollars.","It's, It'll, Its, This","It's","two, second, twice, couple, duet","two","thousand, thousands, thousandth","thousand","dollars, dolls, dollop, doll, dollar","dollars","",".","","","","","","","","","",""
"81","190","Это стоит 4 миллиона долларов.","It costs 4 million dollars","It, He, Him, His, Its","It","costs, cost, costing, costed, cost's","costs","","4","million, millionth, millionaire","million","dollars, dolls, dollop, doll, dollar","dollars","","","","","","","","","",""
"82","190","У него есть десять тысяч человек.","He has ten thousand men.","He, Him, His, It, Its","He","has, had, have, having, haves, haveta, haveing, have led","has","ten, tens, tened, tenning, tenned","ten","thousand, thousands, thousandth","thousand","men, mens, menning, mener","men","",".","","","","","","","",""
"83","190","Это 20 тысяч долларов.","It's 20 thousand dollars.","It's, It'll, Its, This","It's","","20","thousand, thousands, thousandth","thousand","dollars, dolls, dollop, doll, dollar","dollars","",".","","","","","","","","","",""
"84","190","Это радио стоит двадцать девять долларов.","This radio is twenty-nine dollars.","This, It'll, It's, Its","This","radio, radios, radioed, radioing, radioes, radios', radio'd","radio","is, be, been, are, was, were, will, shall","is","twenty-nine, twenties, twentieth, twenty","twenty-nine","dollars, dolls, dollop, doll, dollar","dollars","",".","","","","","","","",""
"85","190","Это один из самых лучших способов выучить английский язык быстро.","This is one of the best ways to learn English quickly.","This, It'll, It's, Its","This","is, be, been, are, was, were, will, shall","is","one, once, first","one","of, from, by, on, in, off, out of, at","of","the, then, though","the","best, bested, bestest, besting, bester, bests, best best","best","ways, way, waid, wayer, waies, waied","ways","to, on, in, at, since, for, ago, before","to","learn, learned, learning, learnt, learns, learnning","learn","English, Englishes, Englished, Englishs, Englishing","English"
"86","190","Полёт занимает сорок пять минут.","The flight takes forty-five minutes.","The, Then, Though","The","flight, flights, flighting, flighted, flighter, flightin'","flight","takes, take, taken, taking, took, taketa, taked, takeing","takes","forty-five, fortieth, fortuitous, forthright, forte, fortify, fortitude, fortification","forty-five","minutes, minute, minutest, minuter, minuted, minuting","minutes","",".","","","","","","","",""
"87","190","У меня есть двадцать долларов.","I have twenty dollars.","I, me, my, mine","I","have, had, has, having, haves, haveta, haveing, have led","have","twenty, twenties, twentys, twentiest, twenties'","twenty","dollars, dolls, dollop, doll, dollar","dollars","",".","","","","","","","","","",""
"88","190","У куба шесть сторон.","A cube has six sides.","A, an","A","cube, cubed, cubes, cubing, cubes'","cube","has, had, have, having, haves, haveta, haveing, have led","has","six, sixes, sixed, sixes'","six","sides, side, siding, sided, sider, sode","sides","",".","","","","","","","",""
"89","190","Каждый урок длится сорок минут.","Each lesson lasts forty minutes.","Each","Each","lesson, lessons, lessoned, lessoning","lesson","lasts, last, lasting, lasted, lastest, laster, lasten, lasts'","lasts","forty, forties, fortier, fortid, forties'","forty","minutes, minute, minutest, minuter, minuted, minuting","minutes","",".","","","","","","","",""
"90","190","В том здании пятьдесят четыре этажа.","That building has fifty-four floors.","That, Those, Thats, That led","That","building, builder, buildup, build","building","has, had, have, having, haves, haveta, haveing, have led","has","fifty-four, fiftieth, fifteenth, fifth, fifteen, fifty","fifty-four","floors, floor, floorer, flooring, floored, floors'","floors","",".","","","","","","","",""
"91","190","У этого стула три ножки.","This chair has three legs.","This, It'll, It's, Its","This","chair, chairs, chaired, chairing","chair","has, had, have, having, haves, haveta, haveing, have led","has","three, threes, threten, threes'","three","legs, leg, legged, legging, legder","legs","",".","","","","","","","",""
"92","190","У стола четыре ножки.","The table has four legs.","The, Then, Though","The","table, tables, tabled, tabling, tabler","table","has, had, have, having, haves, haveta, haveing, have led","has","four, fours, foured","four","legs, leg, legged, legging, legder","legs","",".","","","","","","","",""
"93","190","Игра длится шесть минут.","The game lasts six minutes.","The, Then, Though","The","game, games, gamed, gaming, gamest, gamer, gameren, gameing","game","lasts, last, lasting, lasted, lastest, laster, lasten, lasts'","lasts","six, sixes, sixed, sixes'","six","minutes, minute, minutest, minuter, minuted, minuting","minutes","",".","","","","","","","",""
"94","190","Полет занимает восемь часов.","The flight takes eight hours.","The, Then, Though","The","flight, flights, flighting, flighted, flighter, flightin'","flight","takes, take, taken, taking, took, taketa, taked, takeing","takes","eight, eights, eighter, eights'","eight","hours, hourglass, hourly, hour","hours","",".","","","","","","","",""
"95","190","У моего друга восемь кузенов.","My friend has eight cousins.","My, I, Me, Mine","My","friend, friends, friending, friended","friend","has, had, have, having, haves, haveta, haveing, have led","has","eight, eights, eighter, eights'","eight","cousins, cousin","cousins","",".","","","","","","","",""
"96","190","Тринадцать это несчастливое число.","Thirteen is an unlucky number.","Thirteen, Thirtieth, Thirteenth, Thirty","Thirteen","is, be, been, are, was, were, will, shall","is","an, a","an","unlucky, unluckies, unluckiest, unluckier","unlucky","number, numbers, numbered, numbering, numberest","number","",".","","","","","","","",""
"97","190","В каждой неделе семь дней.","Each week has seven days.","Each","Each","week, weeks, weeked","week","has, had, have, having, haves, haveta, haveing, have led","has","seven, sevens, sevens'","seven","days, day, daid, daies, daybed, daybest, daying, dayta","days","",".","","","","","","","",""
"98","190","В моей школе тридцать учителей.","There are thirty teachers in my school.","There, Theres, Thered, Thering","There","are, is, be, been, was, were, will, shall","are","thirty, thirtieth, thirteenth, thirteen","thirty","teachers, teaching, teacher, teach","teachers","in, on, at, since, for, ago, before, to","in","my, i, me, mine","my","school, schooling, schools, schooled","school","",".","","","",""
"99","190","У платья четыре части.","The dress has four parts.","The, Then, Though","The","dress, dresser, dressing, dressed, dresses, dresses'","dress","has, had, have, having, haves, haveta, haveing, have led","has","four, fours, foured","four","parts, part, parted, parting, parter","parts","",".","","","","","","","",""
"100","190","В опере есть три части.","The opera has three parts.","The, Then, Though","The","opera, operas, operae","opera","has, had, have, having, haves, haveta, haveing, have led","has","three, threes, threten, threes'","three","parts, part, parted, parting, parter","parts","",".","","","","","","","",""
"101","190","У каждой истории две стороны.","Every story has two sides.","Every, Everybody's, Everyone's, Everything's, Everytime, Everyday, Everywhere, Everybody","Every","story, stories, storys, storying","story","has, had, have, having, haves, haveta, haveing, have led","has","two, second, twice, couple, duet","two","sides, side, siding, sided, sider, sode","sides","",".","","","","","","","",""
"102","190","Моему другу двадцать лет.","My friend is twenty years old.","My, I, Me, Mine","My","friend, friends, friending, friended","friend","is, be, been, are, was, were, will, shall","is","twenty, twenties, twentys, twentiest, twenties'","twenty","years, year, yeard, yeared, yearing","years","old, elder, eldest, oldest, older, olds, olding","old","",".","","","","","",""
"103","190","У меня есть две задачи.","I have two tasks.","I, me, my, mine","I","have, had, has, having, haves, haveta, haveing, have led","have","two, second, twice, couple, duet","two","tasks, task, tasked, tasking, task'd, tasks'","tasks","",".","","","","","","","","","",""
"104","190","У дракона три головы.","The dragon has three heads.","The, Then, Though","The","dragon, dragonfly, drag","dragon","has, had, have, having, haves, haveta, haveing, have led","has","three, threes, threten, threes'","three","heads, head, headed, header, heading","heads","",".","","","","","","","",""
"105","190","Дюйм - это 2,54 сантиметра.","An inch is 2.54 centimeters.","An, A","An","inch, inches, inched, inching, incher, inchs","inch","is, be, been, are, was, were, will, shall","is","","2.54","centimeters, centimeter, centimetered","centimeters","",".","","","","","","","",""
"106","190","Каждая кошка ловит семь мышей.","Each cat catches seven mice.","Each","Each","cat, cats, catted, catting, catter","cat","catches, catch, catching, caught, catched, catchs","catches","seven, sevens, sevens'","seven","mice, mouse, mousing, moused, mouses","mice","",".","","","","","","","",""
"107","190","Нам нужно три лошади.","We need three horses.","We, Our, Us, Ours","We","need, needs, needed, needing, needer, needded","need","three, threes, threten, threes'","three","horses, horse, horsing, horsed, horser, hors'd","horses","",".","","","","","","","","","",""
"108","190","Вы выигрываете десять долларов.","You win ten dollars.","You, Your, Yours","You","win, winning, won, wins, winer, winned, wins'","win","ten, tens, tened, tenning, tenned","ten","dollars, dolls, dollop, doll, dollar","dollars","",".","","","","","","","","","",""
"109","190","У меня две картины.","I have two pictures.","I, me, my, mine","I","have, had, has, having, haves, haveta, haveing, have led","have","two, second, twice, couple, duet","two","pictures, picture, pictured, picturing","pictures","",".","","","","","","","","","",""
"110","190","У нас двадцать деревьев.","We have twenty trees.","We, Our, Us, Ours","We","have, had, has, having, haves, haveta, haveing, have led","have","twenty, twenties, twentys, twentiest, twenties'","twenty","trees, tree, treed, treeger, treten, treeing","trees","",".","","","","","","","","","",""
"111","190","У нас пять кроликов.","We have five rabbits.","We, Our, Us, Ours","We","have, had, has, having, haves, haveta, haveing, have led","have","five, fives, fived, fiving, fiveing","five","rabbits, rabbit, rabbiting, rabbited, rabbitting","rabbits","",".","","","","","","","","","",""
"112","190","Там четыре аэропорта.","There are four airports.","There, Theres, Thered, Thering","There","are, is, be, been, was, were, will, shall","are","four, fours, foured","four","airports, airport, airports'","airports","",".","","","","","","","","","",""
"113","190","У нас пять уроков каждую неделю.","We have five lessons each week.","We, Our, Us, Ours","We","have, had, has, having, haves, haveta, haveing, have led","have","five, fives, fived, fiving, fiveing","five","lessons, lesson, lessoned, lessoning","lessons","each","each","week, weeks, weeked","week","",".","","","","","",""
"114","190","В парке две части.","The park has two parts.","The, Then, Though","The","park, parking, parks, parked, parks'","park","has, had, have, having, haves, haveta, haveing, have led","has","two, second, twice, couple, duet","two","parts, part, parted, parting, parter","parts","",".","","","","","","","",""
"115","190","Я знаю пять языков.","I know five languages.","I, me, my, mine","I","know, knew, knowing, known, knows, knowed, knowest, knower","know","five, fives, fived, fiving, fiveing","five","languages, language, languaging","languages","",".","","","","","","","","","",""
"116","190","У меня четыре дочери.","I have four daughters.","I, me, my, mine","I","have, had, has, having, haves, haveta, haveing, have led","have","four, fours, foured","four","daughters, daughter, daughtered","daughters","",".","","","","","","","","","",""
"117","190","У меня было три кошки.","I had three cats.","I, me, my, mine","I","had, has, have, having, haves, haveta, haveing, have led","had","three, threes, threten, threes'","three","cats, cat, catted, catting, catter","cats","",".","","","","","","","","","",""
"118","190","Я отправил миллион сообщений!","I sent a million messages!","I, me, my, mine","I","sent, send, sends, sending, sended, sendest","sent","a, an","a","million, millionth, millionaire","million","messages, message, messager, messaging, messaged","messages","","!","","","","","","","",""
"119","190","Я написал тысячу книг.","I wrote a thousand books.","I, me, my, mine","I","wrote, write, writing, written, writes, writeing, writes', write's","wrote","a, an","a","thousand, thousands, thousandth","thousand","books, book, booked, booking, booker","books","",".","","","","","","","",""
"120","190","Я просил миллион раз.","I asked a million times","I, me, my, mine","I","asked, ask, asking, asks, askest, asks'","asked","a, an","a","million, millionth, millionaire","million","times, time, timer, timing, timed, timeger, timest, timeing","times","","","","","","","","","",""
"121","190","Я пытаюсь десять раз.","I try ten times.","I, me, my, mine","I","try, tried, trying, tries, tryed, tryta, trys, try best","try","ten, tens, tened, tenning, tenned","ten","times, time, timer, timing, timed, timeger, timest, timeing","times","",".","","","","","","","","","",""
"122","190","У вас пятнадцать минут.","You have fifteen minutes.","You, Your, Yours","You","have, had, has, having, haves, haveta, haveing, have led","have","fifteen, fiftieth, fifteenth, fifth, fifty","fifteen","minutes, minute, minutest, minuter, minuted, minuting","minutes","",".","","","","","","","","","",""
"123","190","У вас три сообщения.","You have three messages.","You, Your, Yours","You","have, had, has, having, haves, haveta, haveing, have led","have","three, threes, threten, threes'","three","messages, message, messager, messaging, messaged","messages","",".","","","","","","","","","",""
"124","190","У меня тридцать минут.","I have thirty minutes.","I, me, my, mine","I","have, had, has, having, haves, haveta, haveing, have led","have","thirty, thirtieth, thirteenth, thirteen","thirty","minutes, minute, minutest, minuter, minuted, minuting","minutes","",".","","","","","","","","","",""
"125","190","Я вижу двух девочек.","I see two girls.","I, me, my, mine","I","see, saw, seeing, seen, sees, seemest, seeger, seeta","see","two, second, twice, couple, duet","two","girls, girl, girled","girls","",".","","","","","","","","","",""
"126","190","У вас семь часов.","You have seven hours.","You, Your, Yours","You","have, had, has, having, haves, haveta, haveing, have led","have","seven, sevens, sevens'","seven","hours, hourglass, hourly, hour","hours","",".","","","","","","","","","",""
"127","190","У вас две квартиры.","You have two flats.","You, Your, Yours","You","have, had, has, having, haves, haveta, haveing, have led","have","two, second, twice, couple, duet","two","flats, flat, flatter, flatting, flattest, flatbed, flatted, flats'","flats","",".","","","","","","","","","",""
"128","190","У меня четыре монеты.","I have four coins.","I, me, my, mine","I","have, had, has, having, haves, haveta, haveing, have led","have","four, fours, foured","four","coins, coin, coiner, coined, coining, coin'd, coins'","coins","",".","","","","","","","","","",""
"129","190","У меня тридцать долларов.","I have thirty dollars.","I, me, my, mine","I","have, had, has, having, haves, haveta, haveing, have led","have","thirty, thirtieth, thirteenth, thirteen","thirty","dollars, dolls, dollop, doll, dollar","dollars","",".","","","","","","","","","",""
"130","190","Я хочу шестьдесят долларов.","I want sixty dollars.","I, me, my, mine","I","want, won't, wont","want","sixty, sixteenth, sixth, sixteen","sixty","dollars, dolls, dollop, doll, dollar","dollars","",".","","","","","","","","","",""
"131","190","Мне нужно восемьдесят долларов.","I need eighty dollars.","I, me, my, mine","I","need, needs, needed, needing, needer, needded","need","eighty, eighteenth, eighth, eighteen, eight","eighty","dollars, dolls, dollop, doll, dollar","dollars","",".","","","","","","","","","",""
"132","190","У тебя пятьдесят долларов!","You have fifty dollars!","You, Your, Yours","You","have, had, has, having, haves, haveta, haveing, have led","have","fifty, fifties, fiftys, fifties'","fifty","dollars, dolls, dollop, doll, dollar","dollars","","!","","","","","","","","","",""
"133","190","У меня семь сестёр.","I have seven sisters.","I, me, my, mine","I","have, had, has, having, haves, haveta, haveing, have led","have","seven, sevens, sevens'","seven","sisters, sister, sistered","sisters","",".","","","","","","","","","",""
"134","190","Я выбираю пять цифр.","I choose five numbers.","I, me, my, mine","I","choose, chose, chosen, chooses, choosing, choosest, choosed","choose","five, fives, fived, fiving, fiveing","five","numbers, number, numbered, numbering, numberest","numbers","",".","","","","","","","","","",""
"135","190","У вас четыре минуты.","You have four minutes.","You, Your, Yours","You","have, had, has, having, haves, haveta, haveing, have led","have","four, fours, foured","four","minutes, minute, minutest, minuter, minuted, minuting","minutes","",".","","","","","","","","","",""
"136","190","У тебя три дня.","You have three days.","You, Your, Yours","You","have, had, has, having, haves, haveta, haveing, have led","have","three, threes, threten, threes'","three","days, day, daid, daies, daybed, daybest, daying, dayta","days","",".","","","","","","","","","",""
"137","190","У тебя десять заданий.","You have ten tasks.","You, Your, Yours","You","have, had, has, having, haves, haveta, haveing, have led","have","ten, tens, tened, tenning, tenned","ten","tasks, task, tasked, tasking, task'd, tasks'","tasks","",".","","","","","","","","","",""
"138","190","Мы используем два языка.","We use two languages.","We, Our, Us, Ours","We","use, used, using, uses, useta, useing, use's","use","two, second, twice, couple, duet","two","languages, language, languaging","languages","",".","","","","","","","","","",""
"139","190","У меня восемь долларов.","I have eight dollars.","I, me, my, mine","I","have, had, has, having, haves, haveta, haveing, have led","have","eight, eights, eighter, eights'","eight","dollars, dolls, dollop, doll, dollar","dollars","",".","","","","","","","","","",""
"140","190","У вас пятьдесят минут.","You have fifty minutes.","You, Your, Yours","You","have, had, has, having, haves, haveta, haveing, have led","have","fifty, fifties, fiftys, fifties'","fifty","minutes, minute, minutest, minuter, minuted, minuting","minutes","",".","","","","","","","","","",""
"141","190","Я возвращаюсь через пять минут.","I am back in five minutes.","I, me, my, mine","I","am, are, be, been, being, is, was, were","am","back, backed, backer, backing, backs","back","in, on, at, since, for, ago, before, to","in","five, fives, fived, fiving, fiveing","five","minutes, minute, minutest, minuter, minuted, minuting","minutes","",".","","","","","",""
"142","190","Нам нужно два дня.","We need two days.","We, Our, Us, Ours","We","need, needs, needed, needing, needer, needded","need","two, second, twice, couple, duet","two","days, day, daid, daies, daybed, daybest, daying, dayta","days","",".","","","","","","","","","",""
"143","190","Я иду в кровать через пять минут.","I go to bed in five minutes.","I, me, my, mine","I","go, going, gone, went, goes, gos, goed, gota","go","to, on, in, at, since, for, ago, before","to","bed, bedding, beds, bedded, beder, bednest","bed","in, on, at, since, for, ago, before, to","in","five, fives, fived, fiving, fiveing","five","minutes, minute, minutest, minuter, minuted, minuting","minutes","",".","","","",""
"144","190","Я знаю миллион песен.","I know a million songs.","I, me, my, mine","I","know, knew, knowing, known, knows, knowed, knowest, knower","know","a, an","a","million, millionth, millionaire","million","songs, song, songed, songer","songs","",".","","","","","","","",""
"145","190","Она спит шесть часов.","She sleeps for six hours.","She, Her, Hers","She","sleeps, sleep, slept, sleeping, sleepest, sleeped, sleepping, sleepped","sleeps","for, on, in, at, since, ago, before, to","for","six, sixes, sixed, sixes'","six","hours, hourglass, hourly, hour","hours","",".","","","","","","","",""
"146","190","Я возвращаюсь через шесть месяцев.","I come back in six months.","I, me, my, mine","I","come, came, coming, comes, comest, comeing","come","back, backed, backer, backing, backs","back","in, on, at, since, for, ago, before, to","in","six, sixes, sixed, sixes'","six","months, monthly, month","months","",".","","","","","",""
"147","190","Я могу прийти туда через десять минут.","I can come there in ten minutes.","I, me, my, mine","I","can, could, must, should, would","can","come, came, coming, comes, comest, comeing","come","there, theres, thered, thering","there","in, on, at, since, for, ago, before, to","in","ten, tens, tened, tenning, tenned","ten","minutes, minute, minutest, minuter, minuted, minuting","minutes","",".","","","",""
