ID,Page ID,Local text,English text,Mix 1,Correct 1,Mix 2,Correct 2,Mix 3,Correct 3,Mix 4,Correct 4,Mix 5,Correct 5,Mix 6,Correct 6,Mix 7,Correct 7,Mix 8,Correct 8,Mix 9,Correct 9,Mix 10,Correct 10
"1","190","У их семьи есть три квартиры.","Their family has three flats.","Their, They, Them, Theirs","Their","family, families, familys, familier","family","has, had, have, having, haves, haveta, haveing, have led","has","three, threes, threten, threes'","three","flats, flat, flatter, flatting, flattest, flatbed, flatted, flats'","flats","",".","","","","","","","",""
"2","190","В каждом видео две части.","Each video has two parts.","Each","Each","video, videos, videoed, videoing, videos'","video","has, had, have, having, haves, haveta, haveing, have led","has","two, second, twice, couple, duet","two","parts, part, parted, parting, parter","parts","",".","","","","","","","",""
"3","190","В моем телевизоре шестьдесят четыре канала.","My TV has sixty-four channels.","My, I, Me, Mine","My","TV, TVS","TV","has, had, have, having, haves, haveta, haveing, have led","has","sixty-four, sixteenth, sixth, sixteen, sixty","sixty-four","channels, channel, channelled, channeled, channeling, channelling","channels","",".","","","","","","","",""
"4","190","В книге две части.","The book has two parts.","The, Then, Though","The","book, booked, booking, booker, books","book","has, had, have, having, haves, haveta, haveing, have led","has","two, second, twice, couple, duet","two","parts, part, parted, parting, parter","parts","",".","","","","","","","",""
"5","190","Эта программа занимает четыре месяца.","This program takes four months.","This, It'll, It's, Its","This","program, programs, programming, programmed, programing, programed","program","takes, take, taken, taking, took, taketa, taked, takeing","takes","four, fours, foured","four","months, monthly, month","months","",".","","","","","","","",""
"6","190","В этом здании двадцать два этажа.","This building has twenty-two floors.","This, It'll, It's, Its","This","building, builder, buildup, build","building","has, had, have, having, haves, haveta, haveing, have led","has","twenty-two, twenties, twentieth, twenty","twenty-two","floors, floor, floorer, flooring, floored, floors'","floors","",".","","","","","","","",""
"7","190","В этой группе два певца.","This band has two singers.","This, It'll, It's, Its","This","band, banded, bands, banding, bood","band","has, had, have, having, haves, haveta, haveing, have led","has","two, second, twice, couple, duet","two","singers, sings, singin, singing, singly, singsong, singularity, singularly","singers","",".","","","","","","","",""
"8","190","У каждой истории две стороны.","Every story has two sides","Every, Everybody's, Everyone's, Everything's, Everytime, Everyday, Everywhere, Everybody","Every","story, stories, storys, storying","story","has, had, have, having, haves, haveta, haveing, have led","has","two, second, twice, couple, duet","two","sides, side, siding, sided, sider, sode","sides","","","","","","","","","",""
"9","190","У меня пять уроков сегодня.","I have five lessons today.","I, me, my, mine","I","have, had, has, having, haves, haveta, haveing, have led","have","five, fives, fived, fiving, fiveing","five","lessons, lesson, lessoned, lessoning","lessons","today, todays, todays'","today","",".","","","","","","","",""
"10","190","У женщины два ребёнка.","A woman has two children.","A, an","A","woman, women, womaning, womans, womaned","woman","has, had, have, having, haves, haveta, haveing, have led","has","two, second, twice, couple, duet","two","children, child, childs, childer, chilt","children","",".","","","","","","","",""
"11","190","У каждой команды семь игроков.","Each team has seven players.","Each","Each","team, teams, teaming, teamed, teamin', team'd","team","has, had, have, having, haves, haveta, haveing, have led","has","seven, sevens, sevens'","seven","players, played, plays, playfulness, playing, playstation, playin, playroom","players","",".","","","","","","","",""
"12","190","У моей мамы четыре кошки.","My mother has four cats.","My, I, Me, Mine","My","mother, mothering, mothers, mothered, motherin'","mother","has, had, have, having, haves, haveta, haveing, have led","has","four, fours, foured","four","cats, cat, catted, catting, catter","cats","",".","","","","","","","",""
"13","190","В этом отеле семь этажей.","This hotel has seven floors.","This, It'll, It's, Its","This","hotel, hotels, hoteled, hotels'","hotel","has, had, have, having, haves, haveta, haveing, have led","has","seven, sevens, sevens'","seven","floors, floor, floorer, flooring, floored, floors'","floors","",".","","","","","","","",""
"14","190","Цена составляет три доллара.","The price is three dollars.","The, Then, Though","The","price, priced, pricing, prices","price","is, be, been, are, was, were, will, shall","is","three, threes, threten, threes'","three","dollars, dolls, dollop, doll, dollar","dollars","",".","","","","","","","",""
"15","190","В доме три комнаты.","The house has three rooms.","The, Then, Though","The","house, housing, houses, housed, hous'd","house","has, had, have, having, haves, haveta, haveing, have led","has","three, threes, threten, threes'","three","rooms, room, roomed, rooming, roomin'","rooms","",".","","","","","","","",""
"16","190","Путешествие занимает три часа.","The trip takes three hours.","The, Then, Though","The","trip, tripping, tripped, trips, tripp'd","trip","takes, take, taken, taking, took, taketa, taked, takeing","takes","three, threes, threten, threes'","three","hours, hourglass, hourly, hour","hours","",".","","","","","","","",""
"17","190","В этом модуле две темы.","This module has two topics.","This, It'll, It's, Its","This","module, modulation, modular, modulate","module","has, had, have, having, haves, haveta, haveing, have led","has","two, second, twice, couple, duet","two","topics, topic, topics'","topics","",".","","","","","","","",""
"18","190","Город в десяти милях.","The city is in ten miles.","The, Then, Though","The","city, cities, citys, citier","city","is, be, been, are, was, were, will, shall","is","in, on, at, since, for, ago, before, to","in","ten, tens, tened, tenning, tenned","ten","miles, mile, miled","miles","",".","","","","","",""
"19","190","Дождь наконец-то прекращается после трёх дней.","The rain finally stops after three days.","The, Then, Though","The","rain, rains, rained, raining, rainer, rains'","rain","finally, finalist, finale, finalize, finality, final","finally","stops, stop, stopping, stopped","stops","after, afters, aftera","after","three, threes, threten, threes'","three","days, day, daid, daies, daybed, daybest, daying, dayta","days","",".","","","",""
"20","190","Эта шоколадка стоит всего лишь около тридцати центов.","This chocolate only costs about thirty cents.","This, It'll, It's, Its","This","chocolate, chock","chocolate","only, onliest, onlyest, onlys","only","costs, cost, costing, costed, cost's","costs","about, from, of, by, on, in, off, out of","about","thirty, thirtieth, thirteenth, thirteen","thirty","cents, centuries, centigrade, centrally, centrifugal, centerpiece, centric, centipede","cents","",".","","","",""
"21","190","Тайлер бегает десять километров.","Tyler runs ten kilometers.","Tyler","Tyler","runs, ran, run, runner, running, runned, runer, runnest","runs","ten, tens, tened, tenning, tenned","ten","kilometers, kilometer, kilometer's, kilometers'","kilometers","",".","","","","","","","","","",""
"22","190","Он на двадцать лет старше тебя!","He's twenty years older than you!","He's, He'd, He'll, He're","He's","twenty, twenties, twentys, twentiest, twenties'","twenty","years, year, yeard, yeared, yearing","years","older, elder, eldest, old, oldest, olds, olding","older","than, thaner, thans","than","you, your, yours","you","","!","","","","","",""
"23","190","Она на два года старше меня.","She's two years older than me.","She's, She'd, She'll, She're","She's","two, second, twice, couple, duet","two","years, year, yeard, yeared, yearing","years","older, elder, eldest, old, oldest, olds, olding","older","than, thaner, thans","than","me, i, my, mine","me","",".","","","","","",""
"24","190","Он на два года старше меня.","He's two years older than me.","He's, He'd, He'll, He're","He's","two, second, twice, couple, duet","two","years, year, yeard, yeared, yearing","years","older, elder, eldest, old, oldest, olds, olding","older","than, thaner, thans","than","me, i, my, mine","me","",".","","","","","",""
"25","190","Он на три сантиметра выше, чем она.","He is three centimeters taller than she.","He, Him, His, It, Its","He","is, be, been, are, was, were, will, shall","is","three, threes, threten, threes'","three","centimeters, centimeter, centimetered","centimeters","taller, tall, tallest, talls","taller","than, thaner, thans","than","she, her, hers","she","",".","","","",""
"26","190","Она на десять лет моложе меня.","She's ten years younger than me.","She's, She'd, She'll, She're","She's","ten, tens, tened, tenning, tenned","ten","years, year, yeard, yeared, yearing","years","younger, young, youngest, youngs","younger","than, thaner, thans","than","me, i, my, mine","me","",".","","","","","",""
"27","190","Она на шесть сантиметров выше, чем он!","She's six centimeters taller than him!","She's, She'd, She'll, She're","She's","six, sixes, sixed, sixes'","six","centimeters, centimeter, centimetered","centimeters","taller, tallow, tally, tall","taller","than, thaner, thans","than","him, he, his, it, its","him","","!","","","","","",""
"28","190","Она на две недели младше вас.","She's two weeks younger than you.","She's, She'd, She'll, She're","She's","two, second, twice, couple, duet","two","weeks, week, weeked","weeks","younger, young, youngest, youngs","younger","than, thaner, thans","than","you, your, yours","you","",".","","","","","",""
"29","190","Это длилось семь часов и пятнадцать дней.","It lasted seven hours and 15 days.","It, He, Him, His, Its","It","lasted, last, lasting, lastest, lasts, laster, lasten, lasts'","lasted","seven, sevens, sevens'","seven","hours, hourglass, hourly, hour","hours","and, ands, ood, anded, anding, ander, andren","and","15, 15led","15","days, day, daid, daies, daybed, daybest, daying, dayta","days","",".","","","",""
"30","190","Это длилось два месяца и три дня.","It lasted two months and three days.","It, He, Him, His, Its","It","lasted, last, lasting, lastest, lasts, laster, lasten, lasts'","lasted","two, second, twice, couple, duet","two","months, monthly, month","months","and, ands, ood, anded, anding, ander, andren","and","three, threes, threten, threes'","three","days, day, daid, daies, daybed, daybest, daying, dayta","days","",".","","","",""
"31","190","Это длилось сорок дней и сорок ночей.","It's been forty days and forty nights","It's, It'll, Its, This","It's","been, is, be, are, was, were, will, shall","been","forty, forties, fortier, fortid, forties'","forty","days, day, daid, daies, daybed, daybest, daying, dayta","days","and, ands, ood, anded, anding, ander, andren","and","forty, forties, fortier, fortid, forties'","forty","nights, night, nighter","nights","","","","","",""
"32","190","Это длилось десять месяцев и два дня.","It lasted 10 months and 2 days","It, He, Him, His, Its","It","lasted, last, lasting, lastest, lasts, laster, lasten, lasts'","lasted","","10","months, monthly, month","months","and, ands, ood, anded, anding, ander, andren","and","2, 2ed","2","days, day, daid, daies, daybed, daybest, daying, dayta","days","","","","","",""
"33","190","Без двадцати минут пять.","It's twenty minutes to five.","It's, It'll, Its, This","It's","twenty, twenties, twentys, twentiest, twenties'","twenty","minutes, minute, minutest, minuter, minuted, minuting","minutes","to, on, in, at, since, for, ago, before","to","five, fives, fived, fiving, fiveing","five","",".","","","","","","","",""
"34","190","Без восьми минут десять!","It is eight minutes to ten!","It, He, Him, His, Its","It","is, be, been, are, was, were, will, shall","is","eight, eights, eighter, eights'","eight","minutes, minute, minutest, minuter, minuted, minuting","minutes","to, on, in, at, since, for, ago, before","to","ten, tens, tened, tenning, tenned","ten","","!","","","","","",""
"35","190","Без пяти минут десять.","It is five minutes to ten.","It, He, Him, His, Its","It","is, be, been, are, was, were, will, shall","is","five, fives, fived, fiving, fiveing","five","minutes, minute, minutest, minuter, minuted, minuting","minutes","to, on, in, at, since, for, ago, before","to","ten, tens, tened, tenning, tenned","ten","",".","","","","","",""
"36","190","Без четырёх минут три.","It's four minutes to three.","It's, It'll, Its, This","It's","four, fours, foured","four","minutes, minute, minutest, minuter, minuted, minuting","minutes","to, on, in, at, since, for, ago, before","to","three, threes, threten, threes'","three","",".","","","","","","","",""
"37","190","Без десяти минут три.","It's ten minutes to three.","It's, It'll, Its, This","It's","ten, tens, tened, tenning, tenned","ten","minutes, minute, minutest, minuter, minuted, minuting","minutes","to, on, in, at, since, for, ago, before","to","three, threes, threten, threes'","three","",".","","","","","","","",""
"38","190","Без пяти минут восемь.","It's five minutes to eight.","It's, It'll, Its, This","It's","five, fives, fived, fiving, fiveing","five","minutes, minute, minutest, minuter, minuted, minuting","minutes","to, on, in, at, since, for, ago, before","to","eight, eights, eighter, eights'","eight","",".","","","","","","","",""
"39","190","Без пяти минут шесть.","It's five minutes to six!","It's, It'll, Its, This","It's","five, fives, fived, fiving, fiveing","five","minutes, minute, minutest, minuter, minuted, minuting","minutes","to, on, in, at, since, for, ago, before","to","six, sixes, sixed, sixes'","six","","!","","","","","","","",""
"40","190","Без десяти минут четыре.","It is ten minutes to four.","It, He, Him, His, Its","It","is, be, been, are, was, were, will, shall","is","ten, tens, tened, tenning, tenned","ten","minutes, minute, minutest, minuter, minuted, minuting","minutes","to, on, in, at, since, for, ago, before","to","four, fours, foured","four","",".","","","","","",""
"41","190","Без пяти минут четыре.","It's five minutes to four.","It's, It'll, Its, This","It's","five, fives, fived, fiving, fiveing","five","minutes, minute, minutest, minuter, minuted, minuting","minutes","to, on, in, at, since, for, ago, before","to","four, fours, foured","four","",".","","","","","","","",""
"42","190","Без пяти минут час.","It's five minutes to one.","It's, It'll, Its, This","It's","five, fives, fived, fiving, fiveing","five","minutes, minute, minutest, minuter, minuted, minuting","minutes","to, on, in, at, since, for, ago, before","to","one, once, first","one","",".","","","","","","","",""
"43","190","Без шести минут восемь.","It's six minutes to eight.","It's, It'll, Its, This","It's","six, sixes, sixed, sixes'","six","minutes, minute, minutest, minuter, minuted, minuting","minutes","to, on, in, at, since, for, ago, before","to","eight, eights, eighter, eights'","eight","",".","","","","","","","",""
"44","190","Без трёх минут восемь.","It's three minutes to eight.","It's, It'll, Its, This","It's","three, threes, threten, threes'","three","minutes, minute, minutest, minuter, minuted, minuting","minutes","to, on, in, at, since, for, ago, before","to","eight, eights, eighter, eights'","eight","",".","","","","","","","",""
"45","190","Ответ - две трети.","The answer is two thirds.","The, Then, Though","The","answer, answered, answers, answering, answerer, answerest","answer","is, be, been, are, was, were, will, shall","is","two, second, twice, couple, duet","two","thirds, third, thirded, thirding","thirds","",".","","","","","","","",""
"46","190","У кошки девять жизней.","A cat has nine lives.","A, an","A","cat, cats, catted, catting, catter","cat","has, had, have, having, haves, haveta, haveing, have led","has","nine, nines, ninten, nines'","nine","lives, life, lifer, lifes, lifed, lifeing","lives","",".","","","","","","","",""
"47","190","У моей сестры есть шесть книг.","My sister has six books.","My, I, Me, Mine","My","sister, sisters, sistered","sister","has, had, have, having, haves, haveta, haveing, have led","has","six, sixes, sixed, sixes'","six","books, book, booked, booking, booker","books","",".","","","","","","","",""
"48","190","Рекорд составляет шестьдесят четыре дня.","The record is sixty-four days.","The, Then, Though","The","record, recording, recorded, records","record","is, be, been, are, was, were, will, shall","is","sixty-four, sixteenth, sixth, sixteen, sixty","sixty-four","days, day, daid, daies, daybed, daybest, daying, dayta","days","",".","","","","","","","",""
"49","190","Есть три главных задачи.","There are three main tasks.","There, Theres, Thered, Thering","There","are, is, be, been, was, were, will, shall","are","three, threes, threten, threes'","three","main, mains, maining, mained, mainer, mainest, mains'","main","tasks, task, tasked, tasking, task'd, tasks'","tasks","",".","","","","","","","",""
"50","190","У меня три телефона.","I have three phones.","I, me, my, mine","I","have, had, has, having, haves, haveta, haveing, have led","have","three, threes, threten, threes'","three","phones, phone, phoning, phoned","phones","",".","","","","","","","","","",""
"51","190","У мужчины тринадцать домов.","The man has thirteen houses.","The, Then, Though","The","man, manned, manning, men, maning, mans, maned, maner","man","has, had, have, having, haves, haveta, haveing, have led","has","thirteen, thirtieth, thirteenth, thirty","thirteen","houses, house, housing, housed, hous'd","houses","",".","","","","","","","",""
"52","190","У здания десять этажей.","The building has ten floors.","The, Then, Though","The","building, builder, buildup, build","building","has, had, have, having, haves, haveta, haveing, have led","has","ten, tens, tened, tenning, tenned","ten","floors, floor, floorer, flooring, floored, floors'","floors","",".","","","","","","","",""
"53","190","У моей собаки три щенка.","My dog has three puppies.","My, I, Me, Mine","My","dog, dogged, dogs, dogging, dogbed","dog","has, had, have, having, haves, haveta, haveing, have led","has","three, threes, threten, threes'","three","puppies, puppy, puppied, puppys","puppies","",".","","","","","","","",""
"54","190","Видео длится девять минут.","The video lasts nine minutes.","The, Then, Though","The","video, videos, videoed, videoing, videos'","video","lasts, last, lasting, lasted, lastest, laster, lasten, lasts'","lasts","nine, nines, ninten, nines'","nine","minutes, minute, minutest, minuter, minuted, minuting","minutes","",".","","","","","","","",""
"55","190","Это занимает восемь лет.","It takes eight years.","It, He, Him, His, Its","It","takes, take, taken, taking, took, taketa, taked, takeing","takes","eight, eights, eighter, eights'","eight","years, year, yeard, yeared, yearing","years","",".","","","","","","","","","",""
"56","190","Эти туфли стоят сорок пять долларов.","These shoes are forty-five dollars.","These, Thesis","These","shoes, shod, shoe, shodden, shoeing, shoten","shoes","are, is, be, been, was, were, will, shall","are","forty-five, fortieth, fortuitous, forthright, forte, fortify, fortitude, forthwith","forty-five","dollars, dolls, dollop, doll, dollar","dollars","",".","","","","","","","",""
"57","190","Этой кошке двенадцать лет.","This cat is twelve years old.","This, It'll, It's, Its","This","cat, cats, catted, catting, catter","cat","is, be, been, are, was, were, will, shall","is","twelve, twelfth","twelve","years, year, yeard, yeared, yearing","years","old, elder, eldest, oldest, older, olds, olding","old","",".","","","","","",""
"58","190","Каждое занятие длится три часа.","Each class lasts three hours.","Each","Each","class, classes, classed, classing, classer","class","lasts, last, lasting, lasted, lastest, laster, lasten, lasts'","lasts","three, threes, threten, threes'","three","hours, hourglass, hourly, hour","hours","",".","","","","","","","",""
"59","190","Матч занимает семьдесят минут.","The match takes seventy minutes.","The, Then, Though","The","match, matched, matches, matching, matchs","match","takes, take, taken, taking, took, taketa, taked, takeing","takes","seventy, seventeenth, seventh, seventeen","seventy","minutes, minute, minutest, minuter, minuted, minuting","minutes","",".","","","","","","","",""
"60","190","Я живу здесь семь лет.","I live here for seven years.","I, me, my, mine","I","live, liver, lives, living, lived, livest, liveing","live","here, heres, hering, hered","here","for, on, in, at, since, ago, before, to","for","seven, sevens, sevens'","seven","years, year, yeard, yeared, yearing","years","",".","","","","","",""
"61","190","В той песне более ста строчек.","That song has over a hundred lines.","That, Those, Thats, That led","That","song, songs, songed, songer","song","has, had, have, having, haves, haveta, haveing, have led","has","over, in, at, on, by, next to, beside, under","over","a, an","a","hundred, hundreds, hundreds'","hundred","lines, line, lined, lining, lineger, linten, lineing","lines","",".","","","",""
"62","190","У нее миллион платьев.","She has a million dresses.","She, Her, Hers","She","has, had, have, having, haves, haveta, haveing, have led","has","a, an","a","million, millionth, millionaire","million","dresses, dress, dresser, dressing, dressed, dresses'","dresses","",".","","","","","","","",""
"63","190","В городе пять музеев.","There are five museums in the city.","There, Theres, Thered, Thering","There","are, is, be, been, was, were, will, shall","are","five, fives, fived, fiving, fiveing","five","museums, museum, museums'","museums","in, on, at, since, for, ago, before, to","in","the, then, though","the","city, cities, citys, citier","city","",".","","","",""
"64","190","Женщина приходит сюда каждые две недели.","A woman comes here every two weeks.","A, an","A","woman, women, womaning, womans, womaned","woman","comes, came, come, coming, comest, comeing","comes","here, heres, hering, hered","here","every, everybody's, everyone's, everything's, everytime, everyday, everywhere, everybody","every","two, second, twice, couple, duet","two","weeks, week, weeked","weeks","",".","","","",""
"65","190","Один день, как тысяча лет.","A day is like a thousand years","A, an","A","day, days, daid, daies, daybed, daybest, daying, dayta","day","is, be, been, are, was, were, will, shall","is","like, liking, likes, liked, likest, liker, licken, likeing","like","a, an","a","thousand, thousands, thousandth","thousand","years, year, yeard, yeared, yearing","years","","","","","",""
"66","190","Нет платформы девять и три четверти.","There is no platform nine and three-quarters.","There, Theres, Thered, Thering","There","is, be, been, are, was, were, will, shall","is","no, not, none, neither, nore, nope","no","platform, platforms, platformed, platforming","platform","nine, nines, ninten, nines'","nine","and, ands, ood, anded, anding, ander, andren","and","three-quarters, threatened, threw, threesome, threateningly, threadbare, thresh, threshold","three-quarters","",".","","","",""
"67","190","У неё семьдесят тысяч фунтов.","She has seventy thousand pounds.","She, Her, Hers","She","has, had, have, having, haves, haveta, haveing, have led","has","seventy, seventeenth, seventh, seventeen","seventy","thousand, thousands, thousandth","thousand","pounds, pound, pounding, pounded","pounds","",".","","","","","","","",""
"68","190","Это 20 миллионов лет.","It's 20 million years.","It's, It'll, Its, This","It's","","20","million, millionth, millionaire","million","years, year, yeard, yeared, yearing","years","",".","","","","","","","","","",""
"69","190","Это шестьсот рублей.","It's six hundred rubles.","It's, It'll, Its, This","It's","six, sixes, sixed, sixes'","six","hundred, hundreds, hundreds'","hundred","rubles, ruble, rubler, ruble's","rubles","",".","","","","","","","","","",""
