ID,Page ID,Local text,English text,Mix 1,Correct 1,Mix 2,Correct 2,Mix 3,Correct 3,Mix 4,Correct 4,Mix 5,Correct 5,Mix 6,Correct 6,Mix 7,Correct 7,Mix 8,Correct 8,Mix 9,Correct 9,Mix 10,Correct 10
"148","190","Я могу быть там через пятнадцать минут.","I can be there in fifteen minutes.","I, me, my, mine","I","can, could, must, should, would","can","be, is, been, are, was, were, will, shall","be","there, theres, thered, thering","there","in, on, at, since, for, ago, before, to","in","fifteen, fiftieth, fifteenth, fifth, fifty","fifteen","minutes, minute, minutest, minuter, minuted, minuting","minutes","",".","","","",""
"149","190","Мы можем быть там через двадцать минут.","We can be there in twenty minutes.","We, Our, Us, Ours","We","can, could, must, should, would","can","be, is, been, are, was, were, will, shall","be","there, theres, thered, thering","there","in, on, at, since, for, ago, before, to","in","twenty, twenties, twentys, twentiest, twenties'","twenty","minutes, minute, minutest, minuter, minuted, minuting","minutes","",".","","","",""
"150","190","Мы опаздываем на сорок пять минут.","We are late for forty-five minutes.","We, Our, Us, Ours","We","are, is, be, been, was, were, will, shall","are","late, last, later, latest, latter, lates, lated, lating","late","for, on, in, at, since, ago, before, to","for","forty-five, fortieth, fortuitous, forthright, forte, fortify, fortitude, forthwith","forty-five","minutes, minute, minutest, minuter, minuted, minuting","minutes","",".","","","","","",""
"151","190","Нам нужно шесть дней.","We need six days.","We, Our, Us, Ours","We","need, needs, needed, needing, needer, needded","need","six, sixes, sixed, sixes'","six","days, day, daid, daies, daybed, daybest, daying, dayta","days","",".","","","","","","","","","",""
"152","190","Он спит четыре часа.","He sleeps for four hours.","He, Him, His, It, Its","He","sleeps, sleep, slept, sleeping, sleepest, sleeped, sleepping, sleepped","sleeps","for, on, in, at, since, ago, before, to","for","four, fours, foured","four","hours, hourglass, hourly, hour","hours","",".","","","","","","","",""
"153","190","Мы встречаемся снова через восемь часов.","We meet again in eight hours.","We, Our, Us, Ours","We","meet, meeting, met, meets, meeter, meetest, meeted, meetting","meet","again, against","again","in, on, at, since, for, ago, before, to","in","eight, eights, eighter, eights'","eight","hours, hourglass, hourly, hour","hours","",".","","","","","",""
"154","190","Мы заканчиваем через двадцать минут.","We finish in twenty minutes.","We, Our, Us, Ours","We","finish, finished, finishing, finishes, finishs, finishes', finish's","finish","in, on, at, since, for, ago, before, to","in","twenty, twenties, twentys, twentiest, twenties'","twenty","minutes, minute, minutest, minuter, minuted, minuting","minutes","",".","","","","","","","",""
"155","190","Они начинают через десять минут.","They start in ten minutes.","They, Them, Their, Theirs","They","start, starting, started, starts, startted, starttest, start'd","start","in, on, at, since, for, ago, before, to","in","ten, tens, tened, tenning, tenned","ten","minutes, minute, minutest, minuter, minuted, minuting","minutes","",".","","","","","","","",""
"156","190","У нас есть три группы.","We have three groups.","We, Our, Us, Ours","We","have, had, has, having, haves, haveta, haveing, have led","have","three, threes, threten, threes'","three","groups, group, grouping, grouped, groupper","groups","",".","","","","","","","","","",""
"157","190","Мы начнем через тридцать минут.","We begin in thirty minutes.","We, Our, Us, Ours","We","begin, began, beginning, begun, begins, beginnest, begining, beginer","begin","in, on, at, since, for, ago, before, to","in","thirty, thirtieth, thirteenth, thirteen","thirty","minutes, minute, minutest, minuter, minuted, minuting","minutes","",".","","","","","","","",""
"158","190","Мы возвращаемся через три дня.","We come back in three days.","We, Our, Us, Ours","We","come, came, coming, comes, comest, comeing","come","back, backed, backer, backing, backs","back","in, on, at, since, for, ago, before, to","in","three, threes, threten, threes'","three","days, day, daid, daies, daybed, daybest, daying, dayta","days","",".","","","","","",""
"159","190","Она возвращается через две недели.","She comes back in two weeks.","She, Her, Hers","She","comes, came, come, coming, comest, comeing","comes","back, backed, backer, backing, backs","back","in, on, at, since, for, ago, before, to","in","two, second, twice, couple, duet","two","weeks, week, weeked","weeks","",".","","","","","",""
"160","190","Я здесь четыре месяца.","I am here for four months.","I, me, my, mine","I","am, are, be, been, being, is, was, were","am","here, heres, hering, hered","here","for, on, in, at, since, ago, before, to","for","four, fours, foured","four","months, monthly, month","months","",".","","","","","",""
"161","190","Дай мне пятнадцать секунд!","Give me fifteen seconds!","Give, Gave, Given, Giving, Gives, Givest, Gived, Giveing","Give","me, i, my, mine","me","fifteen, fiftieth, fifteenth, fifth, fifty","fifteen","seconds, second, seconded, seconding, secondbest","seconds","","!","","","","","","","","","",""
"162","190","Они прибывают через пятнадцать минут.","They arrive in fifteen minutes.","They, Them, Their, Theirs","They","arrive, arrived, arrives, arriving, arriven","arrive","in, on, at, since, for, ago, before, to","in","fifteen, fiftieth, fifteenth, fifth, fifty","fifteen","minutes, minute, minutest, minuter, minuted, minuting","minutes","",".","","","","","","","",""
"163","190","Я возвращаюсь через сорок минут.","I come back in forty minutes.","I, me, my, mine","I","come, came, coming, comes, comest, comeing","come","back, backed, backer, backing, backs","back","in, on, at, since, for, ago, before, to","in","forty, forties, fortier, fortid, forties'","forty","minutes, minute, minutest, minuter, minuted, minuting","minutes","",".","","","","","",""
"164","190","Он может быть здесь через три дня.","He can be here in three days.","He, Him, His, It, Its","He","can, could, must, should, would","can","be, is, been, are, was, were, will, shall","be","here, heres, hering, hered","here","in, on, at, since, for, ago, before, to","in","three, threes, threten, threes'","three","days, day, daid, daies, daybed, daybest, daying, dayta","days","",".","","","",""
"165","190","Мы можем быть там через пятнадцать минут.","We can be there in fifteen minutes.","We, Our, Us, Ours","We","can, could, must, should, would","can","be, is, been, are, was, were, will, shall","be","there, theres, thered, thering","there","in, on, at, since, for, ago, before, to","in","fifteen, fiftieth, fifteenth, fifth, fifty","fifteen","minutes, minute, minutest, minuter, minuted, minuting","minutes","",".","","","",""
"166","190","Мне нужно три часа.","I need three hours.","I, me, my, mine","I","need, needs, needed, needing, needer, needded","need","three, threes, threten, threes'","three","hours, hourglass, hourly, hour","hours","",".","","","","","","","","","",""
"167","190","Ты можешь остаться здесь на десять лет.","You can stay here for ten years.","You, Your, Yours","You","can, could, must, should, would","can","stay, stayed, staying, stays, stayest, staies, staied, stays'","stay","here, heres, hering, hered","here","for, on, in, at, since, ago, before, to","for","ten, tens, tened, tenning, tenned","ten","years, year, yeard, yeared, yearing","years","",".","","","",""
"168","190","Мне нужно двадцать минут.","I need twenty minutes.","I, me, my, mine","I","need, needs, needed, needing, needer, needded","need","twenty, twenties, twentys, twentiest, twenties'","twenty","minutes, minute, minutest, minuter, minuted, minuting","minutes","",".","","","","","","","","","",""
"169","190","Мы возвращаемся через два часа.","We come back in two hours.","We, Our, Us, Ours","We","come, came, coming, comes, comest, comeing","come","back, backed, backer, backing, backs","back","in, on, at, since, for, ago, before, to","in","two, second, twice, couple, duet","two","hours, hourglass, hourly, hour","hours","",".","","","","","",""
"170","190","Я вовзращаюсь через сорок пять минут.","I come back in forty-five minutes.","I, me, my, mine","I","come, came, coming, comes, comest, comeing","come","back, backed, backer, backing, backs","back","in, on, at, since, for, ago, before, to","in","forty-five, fortieth, fortuitous, forthright, forte, fortify, fortitude, forthwith","forty-five","minutes, minute, minutest, minuter, minuted, minuting","minutes","",".","","","","","",""
"171","190","Вы можете гулять там через десять минут.","You can walk there in ten minutes.","You, Your, Yours","You","can, could, must, should, would","can","walk, walking, walked, walks, walkest","walk","there, theres, thered, thering","there","in, on, at, since, for, ago, before, to","in","ten, tens, tened, tenning, tenned","ten","minutes, minute, minutest, minuter, minuted, minuting","minutes","",".","","","",""
"172","190","У него только две минуты.","He has only two minutes.","He, Him, His, It, Its","He","has, had, have, having, haves, haveta, haveing, have led","has","only, onliest, onlyest, onlys","only","two, second, twice, couple, duet","two","minutes, minute, minutest, minuter, minuted, minuting","minutes","",".","","","","","","","",""
"173","190","Я могу быть там через пятнадцать минут.","I can be there in fifteen minutes.","I, me, my, mine","I","can, could, must, should, would","can","be, is, been, are, was, were, will, shall","be","there, theres, thered, thering","there","in, on, at, since, for, ago, before, to","in","fifteen, fiftieth, fifteenth, fifth, fifty","fifteen","minutes, minute, minutest, minuter, minuted, minuting","minutes","",".","","","",""
"174","190","Я могу быть там через пять минут.","I can be there in five minutes.","I, me, my, mine","I","can, could, must, should, would","can","be, is, been, are, was, were, will, shall","be","there, theres, thered, thering","there","in, on, at, since, for, ago, before, to","in","five, fives, fived, fiving, fiveing","five","minutes, minute, minutest, minuter, minuted, minuting","minutes","",".","","","",""
"175","190","Мы заканчиваем через два часа.","We finish in two hours.","We, Our, Us, Ours","We","finish, finished, finishing, finishes, finishs, finishes', finish's","finish","in, on, at, since, for, ago, before, to","in","two, second, twice, couple, duet","two","hours, hourglass, hourly, hour","hours","",".","","","","","","","",""
