ID,Page ID,Local text,English text,Mix 1,Correct 1,Mix 2,Correct 2,Mix 3,Correct 3,Mix 4,Correct 4,Mix 5,Correct 5,Mix 6,Correct 6,Mix 7,Correct 7,Mix 8,Correct 8,Mix 9,Correct 9,Mix 10,Correct 10
"1","24","У меня никогда не было приключения.","I've never had an adventure.","I've, I'd, I'll, I'm","I've","never, nevers, never ming","never","had, has, have, having, haves, haveta, haveing, have led","had","an, a","an","adventure, adventures, adventured, adventuring","adventure","",".","","","","","","","",""
"2","24","Я не приготовил ничего.","I haven't prepared anything.","I, me, my, mine","I","haven't, hadn't, hasn't","haven't","prepared, prepare, preparing, prepares, preparest, prepareing","prepared","anything, anytime","anything","",".","","","","","","","","","",""
"3","24","Ты не слышал ничего.","You haven't heard anything","You, Your, Yours","You","haven't, hadn't, hasn't","haven't","heard, hear, hearing, hears, horne, heared, hearther, hearred","heard","anything, anytime","anything","","","","","","","","","","","",""
"4","24","Мы не меняли ничего.","We haven't changed anything.","We, Our, Us, Ours","We","haven't, hadn't, hasn't","haven't","changed, change, changing, changes, changeing","changed","anything, anytime","anything","",".","","","","","","","","","",""
"5","24","Вы не достигли ничего.","You haven't achieved anything.","You, Your, Yours","You","haven't, hadn't, hasn't","haven't","achieved, achieve, achieving, achieves, achieveing, achiev'd","achieved","anything, anytime","anything","",".","","","","","","","","","",""
"6","24","Я не говорил никому.","I haven't told anyone.","I, me, my, mine","I","haven't, hadn't, hasn't","haven't","told, tell, telling, tells, tellest, tollen","told","anyone","anyone","",".","","","","","","","","","",""
"7","24","Вы не пропустили ничего.","You haven't missed anything.","You, Your, Yours","You","haven't, hadn't, hasn't","haven't","missed, miss, missing, misses, misser","missed","anything, anytime","anything","",".","","","","","","","","","",""
"8","24","Я не спрашивал никого.","I haven't asked anyone.","I, me, my, mine","I","haven't, hadn't, hasn't","haven't","asked, ask, asking, asks, askest, asks'","asked","anyone","anyone","",".","","","","","","","","","",""
"9","24","Я никогда не использовал магию.","I've never used magic.","I've, I'd, I'll, I'm","I've","never, nevers, never ming","never","used, use, using, uses, useta, useing, use's","used","magic, magics, magics'","magic","",".","","","","","","","","","",""
"10","24","Я не показывал никому.","I haven't shown anyone.","I, me, my, mine","I","haven't, hadn't, hasn't","haven't","shown, show, shower, showing, showed, shows, showest","shown","anyone","anyone","",".","","","","","","","","","",""
"11","24","Вы не видели ничего.","You haven't seen anything.","You, Your, Yours","You","haven't, hadn't, hasn't","haven't","seen, saw, see, seeing, sees, seemest, seeger, seeta","seen","anything, anytime","anything","",".","","","","","","","","","",""
"12","24","Мы не заказывали ничего.","We haven't ordered anything.","We, Our, Us, Ours","We","haven't, hadn't, hasn't","haven't","ordered, order, ordering, orders, orderi, orderest","ordered","anything, anytime","anything","",".","","","","","","","","","",""
"13","24","Вы никогда не теряли ничего.","You've never lost anything.","You've, You'd, You'll, You're","You've","never, nevers, never ming","never","lost, lose, losing, loses, losest, losed, loseing","lost","anything, anytime","anything","",".","","","","","","","","","",""
"14","24","Я не скрывал ничего.","I have not hidden anything.","I, me, my, mine","I","have, had, has, having, haves, haveta, haveing, have led","have","not, no, none, neither, nore, nope","not","hidden, hid, hide, hiding, hides, hidest, hided, hideing","hidden","anything, anytime","anything","",".","","","","","","","",""
"15","24","Я не заметил ничего.","I haven't noticed anything.","I, me, my, mine","I","haven't, hadn't, hasn't","haven't","noticed, notice, notices, noticing","noticed","anything, anytime","anything","",".","","","","","","","","","",""
"16","24","Я никогда не понимал музыку.","I've never understood music.","I've, I'd, I'll, I'm","I've","never, nevers, never ming","never","understood, understate, understandably, understatement, understandable, understanding, understand","understood","music, musics, musicer, musics'","music","",".","","","","","","","","","",""
"17","24","Мы никогда не выращивали пшеницу.","We've never grown wheat.","We've, We'd, We'll, We're","We've","never, nevers, never ming","never","grown, grew, grow, growing, grows, growed, growest","grown","wheat","wheat","",".","","","","","","","","","",""
"18","24","Я не встречал никого.","I haven't met anybody.","I, me, my, mine","I","haven't, hadn't, hasn't","haven't","met, meet, meeting, meets, meeter, meetest, meeted, meetting","met","anybody, anybodys, anybodies","anybody","",".","","","","","","","","","",""
"19","24","Вы не делали ничего.","You haven't done anything.","You, Your, Yours","You","haven't, hadn't, hasn't","haven't","done, do, does, did, doing","done","anything, anytime","anything","",".","","","","","","","","","",""
"20","24","Мы не говорили никому.","We haven't told anyone.","We, Our, Us, Ours","We","haven't, hadn't, hasn't","haven't","told, tell, telling, tells, tellest, tollen","told","anyone","anyone","",".","","","","","","","","","",""
"21","24","Я никогда не крал ничего.","I've never stolen anything.","I've, I'd, I'll, I'm","I've","never, nevers, never ming","never","stolen, steal, stealing, stole, stealer, steals, stealest, stealed","stolen","anything, anytime","anything","",".","","","","","","","","","",""
"22","24","Вы не ели ничего.","You haven't eaten anything.","You, Your, Yours","You","haven't, hadn't, hasn't","haven't","eaten, ate, eat, eating, eats, eatest, eated, eatting","eaten","anything, anytime","anything","",".","","","","","","","","","",""
"23","24","Я не брал ничего!","I haven't taken anything!","I, me, my, mine","I","haven't, hadn't, hasn't","haven't","taken, take, taking, took, takes, taketa, taked, takeing","taken","anything, anytime","anything","","!","","","","","","","","","",""
"24","24","Я не потерял веру.","I haven't lost faith.","I, me, my, mine","I","haven't, hadn't, hasn't","haven't","lost, lose, losing, loses, losest, losed, loseing","lost","faith, faiths, faiths'","faith","",".","","","","","","","","","",""
"25","24","Мы не разговаривали сегодня.","We haven't talked today.","We, Our, Us, Ours","We","haven't, hadn't, hasn't","haven't","talked, talk, talking, talks, talkest","talked","today, todays, todays'","today","",".","","","","","","","","","",""
"26","24","Я никогда не обижал никого.","I've never hurt anybody.","I've, I'd, I'll, I'm","I've","never, nevers, never ming","never","hurt, hurts, hurting, hurted, hurtest","hurt","anybody, anybodys, anybodies","anybody","",".","","","","","","","","","",""
"27","24","Я не сломал ничего.","I haven't broken anything.","I, me, my, mine","I","haven't, hadn't, hasn't","haven't","broken, break, breaking, broke, breaks, breakest, breaked","broken","anything, anytime","anything","",".","","","","","","","","","",""
"28","24","Я не побрился сегодня.","I haven't shaved today.","I, me, my, mine","I","haven't, hadn't, hasn't","haven't","shaved, shave, shaven, shaving, shaves","shaved","today, todays, todays'","today","",".","","","","","","","","","",""
"29","24","Я никогда не готовил мясо.","I've never cooked meat.","I've, I'd, I'll, I'm","I've","never, nevers, never ming","never","cooked, cook, cooking, cooks","cooked","meat, meats, meated, meating","meat","",".","","","","","","","","","",""
"30","24","Я никогда не играл в гольф.","I've never played golf.","I've, I'd, I'll, I'm","I've","never, nevers, never ming","never","played, play, playing, plays, plaied, plaies, plays'","played","golf, golfing, golfed, golfs, golves","golf","",".","","","","","","","","","",""
"31","24","Я не построил ничего.","I haven't built anything.","I, me, my, mine","I","haven't, hadn't, hasn't","haven't","built, build, building, builds, builded, buildest, build's","built","anything, anytime","anything","",".","","","","","","","","","",""
"32","24","Вы не сломали ничего.","You haven't broken anything.","You, Your, Yours","You","haven't, hadn't, hasn't","haven't","broken, break, breaking, broke, breaks, breakest, breaked","broken","anything, anytime","anything","",".","","","","","","","","","",""
"33","24","Я никогда не брал деньги взаймы.","I have never borrowed money","I, me, my, mine","I","have, had, has, having, haves, haveta, haveing, have led","have","never, nevers, never ming","never","borrowed, borrow, borrowing, borrows","borrowed","money, monetary","money","","","","","","","","","",""
"34","24","Я никогда не играл в бейсбол.","I've never played baseball.","I've, I'd, I'll, I'm","I've","never, nevers, never ming","never","played, play, playing, plays, plaied, plaies, plays'","played","baseball, based, baseline, basement, base","baseball","",".","","","","","","","","","",""
"35","24","Я не видел никого.","I haven't seen anyone","I, me, my, mine","I","haven't, hadn't, hasn't","haven't","seen, saw, see, seeing, sees, seemest, seeger, seeta","seen","anyone","anyone","","","","","","","","","","","",""
"36","24","Мы не производили ничего.","We have not manufactured anything.","We, Our, Us, Ours","We","have, had, has, having, haves, haveta, haveing, have led","have","not, no, none, neither, nore, nope","not","manufactured, manufacture, manufacturing, manufactures, manufacture's","manufactured","anything, anytime","anything","",".","","","","","","","",""
"37","24","Я не ел сегодня.","I haven't eaten today.","I, me, my, mine","I","haven't, hadn't, hasn't","haven't","eaten, ate, eat, eating, eats, eatest, eated, eatting","eaten","today, todays, todays'","today","",".","","","","","","","","","",""
"38","24","Я никогда не пробовал ничего.","I have never tried anything","I, me, my, mine","I","have, had, has, having, haves, haveta, haveing, have led","have","never, nevers, never ming","never","tried, try, trying, tries, tryed, tryta, trys, try best","tried","anything, anytime","anything","","","","","","","","","",""
"39","24","Я никогда не видел снег.","I've never seen snow.","I've, I'd, I'll, I'm","I've","never, nevers, never ming","never","seen, saw, see, seeing, sees, seemest, seeger, seeta","seen","snow, snowed, snows, snowing, snower, snowbed","snow","",".","","","","","","","","","",""
"40","24","Я не был добрым.","I haven't been kind.","I, me, my, mine","I","haven't, hadn't, hasn't","haven't","been, is, be, are, was, were, will, shall","been","kind, kinds, kinder, kindest, kinded, kinds'","kind","",".","","","","","","","","","",""
"41","24","Мы не видели ничего.","We haven't seen anything","We, Our, Us, Ours","We","haven't, hadn't, hasn't","haven't","seen, saw, see, seeing, sees, seemest, seeger, seeta","seen","anything, anytime","anything","","","","","","","","","","","",""
"42","24","Я не ел ужин.","I haven't eaten dinner.","I, me, my, mine","I","haven't, hadn't, hasn't","haven't","eaten, ate, eat, eating, eats, eatest, eated, eatting","eaten","dinner, dinners, dinners'","dinner","",".","","","","","","","","","",""
"43","24","Мы не делали ничего!","We haven't done anything!","We, Our, Us, Ours","We","haven't, hadn't, hasn't","haven't","done, do, does, did, doing","done","anything, anytime","anything","","!","","","","","","","","","",""
"44","24","Они не видели ничего.","They haven't seen anything.","They, Them, Their, Theirs","They","haven't, hadn't, hasn't","haven't","seen, saw, see, seeing, sees, seemest, seeger, seeta","seen","anything, anytime","anything","",".","","","","","","","","","",""
"45","24","Я никогда не носила розовое.","I've never worn pink.","I've, I'd, I'll, I'm","I've","never, nevers, never ming","never","worn, wear, wearing, wore, wears, worne, weared, weard","worn","pink, pinker, pinks, pinking, pinked, pinkest","pink","",".","","","","","","","","","",""
"46","24","Я никогда не говорил никому.","I have never told anyone.","I, me, my, mine","I","have, had, has, having, haves, haveta, haveing, have led","have","never, nevers, never ming","never","told, tell, telling, tells, tellest, tollen","told","anyone","anyone","",".","","","","","","","",""
"47","24","Я не был терпелив.","I haven't been patient","I, me, my, mine","I","haven't, hadn't, hasn't","haven't","been, is, be, are, was, were, will, shall","been","patient, patients, patientest, patiented","patient","","","","","","","","","","","",""
"48","24","Они не видели никого.","They haven't seen anyone.","They, Them, Their, Theirs","They","haven't, hadn't, hasn't","haven't","seen, saw, see, seeing, sees, seemest, seeger, seeta","seen","anyone","anyone","",".","","","","","","","","","",""
"49","24","Я не показывал никому!","I haven't shown anyone!","I, me, my, mine","I","haven't, hadn't, hasn't","haven't","shown, show, shower, showing, showed, shows, showest","shown","anyone","anyone","","!","","","","","","","","","",""
"50","24","Вы не были там.","You haven't been there.","You, Your, Yours","You","haven't, hadn't, hasn't","haven't","been, is, be, are, was, were, will, shall","been","there, theres, thered, thering","there","",".","","","","","","","","","",""
"51","24","Я не решил ещё.","I haven't decided yet.","I, me, my, mine","I","haven't, hadn't, hasn't","haven't","decided, decide, decides, deciding","decided","yet, already, else, too, either, neither, or","yet","",".","","","","","","","","","",""
"52","24","Я не спал как следует.","I haven't slept properly.","I, me, my, mine","I","haven't, hadn't, hasn't","haven't","slept, sleep, sleeping, sleeps, sleepest, sleeped, sleepping, sleepped","slept","properly, properties, proper, property","properly","",".","","","","","","","","","",""
"53","24","Мы не разговаривали ещё.","We haven't talked yet.","We, Our, Us, Ours","We","haven't, hadn't, hasn't","haven't","talked, talk, talking, talks, talkest","talked","yet, already, else, too, either, neither, or","yet","",".","","","","","","","","","",""
"54","24","Ты не пропустил много.","You haven't missed much.","You, Your, Yours","You","haven't, hadn't, hasn't","haven't","missed, miss, missing, misses, misser","missed","much, more, most, muches","much","",".","","","","","","","","","",""
"55","24","Я не закончил ещё.","I haven't finished yet.","I, me, my, mine","I","haven't, hadn't, hasn't","haven't","finished, finish, finishing, finishes, finishs, finishes', finish's","finished","yet, already, else, too, either, neither, or","yet","",".","","","","","","","","","",""
"56","24","Мы не были одни.","We haven't been alone.","We, Our, Us, Ours","We","haven't, hadn't, hasn't","haven't","been, is, be, are, was, were, will, shall","been","alone, alongside, along","alone","",".","","","","","","","","","",""
"57","24","Мы не заказали ещё.","We haven't ordered yet.","We, Our, Us, Ours","We","haven't, hadn't, hasn't","haven't","ordered, order, ordering, orders, orderi, orderest","ordered","yet, already, else, too, either, neither, or","yet","",".","","","","","","","","","",""
"58","24","Я не пробовал ещё.","I haven't tried yet.","I, me, my, mine","I","haven't, hadn't, hasn't","haven't","tried, try, trying, tries, tryed, tryta, trys, try best","tried","yet, already, else, too, either, neither, or","yet","",".","","","","","","","","","",""
"59","24","Я никогда не был один.","I've never been alone","I've, I'd, I'll, I'm","I've","never, nevers, never ming","never","been, is, be, are, was, were, will, shall","been","alone, alongside, along","alone","","","","","","","","","","","",""
"60","24","Вы не закончили ещё.","You haven't finished yet.","You, Your, Yours","You","haven't, hadn't, hasn't","haven't","finished, finish, finishing, finishes, finishs, finishes', finish's","finished","yet, already, else, too, either, neither, or","yet","",".","","","","","","","","","",""
"61","24","Мы не решили ещё.","We haven't decided yet.","We, Our, Us, Ours","We","haven't, hadn't, hasn't","haven't","decided, decide, decides, deciding","decided","yet, already, else, too, either, neither, or","yet","",".","","","","","","","","","",""
"62","24","Ты никогда не выигрывал ещё.","You have never won yet.","You, Your, Yours","You","have, had, has, having, haves, haveta, haveing, have led","have","never, nevers, never ming","never","won, win, winning, wins, winer, winned, wins'","won","yet, already, else, too, either, neither, or","yet","",".","","","","","","","",""
"63","24","Я никогда не был нигде.","I have never been anywhere.","I, me, my, mine","I","have, had, has, having, haves, haveta, haveing, have led","have","never, nevers, never ming","never","been, is, be, are, was, were, will, shall","been","anywhere, anyways, anyway","anywhere","",".","","","","","","","",""
"64","24","Ты никогда не учился достаточно.","You have never learned enough.","You, Your, Yours","You","have, had, has, having, haves, haveta, haveing, have led","have","never, nevers, never ming","never","learned, learn, learning, learnt, learns, learnning","learned","enough","enough","",".","","","","","","","",""
"65","24","Я не проверял ещё.","I haven't checked yet.","I, me, my, mine","I","haven't, hadn't, hasn't","haven't","checked, check, checker, checks, checking","checked","yet, already, else, too, either, neither, or","yet","",".","","","","","","","","","",""
"66","24","Я не видел много.","I have not seen much.","I, me, my, mine","I","have, had, has, having, haves, haveta, haveing, have led","have","not, no, none, neither, nore, nope","not","seen, saw, see, seeing, sees, seemest, seeger, seeta","seen","much, more, most, muches","much","",".","","","","","","","",""
"67","24","Я не ел ещё.","I haven't eaten yet.","I, me, my, mine","I","haven't, hadn't, hasn't","haven't","eaten, ate, eat, eating, eats, eatest, eated, eatting","eaten","yet, already, else, too, either, neither, or","yet","",".","","","","","","","","","",""
"68","24","Я не спросил ещё.","I haven't asked yet.","I, me, my, mine","I","haven't, hadn't, hasn't","haven't","asked, ask, asking, asks, askest, asks'","asked","yet, already, else, too, either, neither, or","yet","",".","","","","","","","","","",""
"69","24","Я никогда не был там!","I've never been there!","I've, I'd, I'll, I'm","I've","never, nevers, never ming","never","been, is, be, are, was, were, will, shall","been","there, theres, thered, thering","there","","!","","","","","","","","","",""
"70","24","Мы не встретились как следует.","We haven't met properly.","We, Our, Us, Ours","We","haven't, hadn't, hasn't","haven't","met, meet, meeting, meets, meeter, meetest, meeted, meetting","met","properly, properties, proper, property","properly","",".","","","","","","","","","",""
"71","24","Я не был заграницей.","I haven't been abroad.","I, me, my, mine","I","haven't, hadn't, hasn't","haven't","been, is, be, are, was, were, will, shall","been","abroad","abroad","",".","","","","","","","","","",""
"72","24","Я не подписал ещё.","I haven't signed yet.","I, me, my, mine","I","haven't, hadn't, hasn't","haven't","signed, sign, signs, signing","signed","yet, already, else, too, either, neither, or","yet","",".","","","","","","","","","",""
"73","24","Я никогда не болел.","I've never been ill.","I've, I'd, I'll, I'm","I've","never, nevers, never ming","never","been, is, be, are, was, were, will, shall","been","ill, ills, iller, illest, illed, illnest","ill","",".","","","","","","","","","",""
"74","24","Они никогда не были там.","They've never been there.","They've, They'd, They'll, They're","They've","never, nevers, never ming","never","been, is, be, are, was, were, will, shall","been","there, theres, thered, thering","there","",".","","","","","","","","","",""
"75","24","Мы не начали ещё!","We haven't begun yet!","We, Our, Us, Ours","We","haven't, hadn't, hasn't","haven't","begun, began, begin, beginning, begins, beginnest, begining, beginer","begun","yet, already, else, too, either, neither, or","yet","","!","","","","","","","","","",""
"76","24","Они не приехали ещё.","They haven't arrived yet.","They, Them, Their, Theirs","They","haven't, hadn't, hasn't","haven't","arrived, arrive, arrives, arriving, arriven","arrived","yet, already, else, too, either, neither, or","yet","",".","","","","","","","","","",""
"77","24","Я не говорил так.","I have not said so.","I, me, my, mine","I","have, had, has, having, haves, haveta, haveing, have led","have","not, no, none, neither, nore, nope","not","said, say, saying, says, sayest, sayed, sayling, saies","said","so, sota, soren, soes, soing, soed","so","",".","","","","","","","",""
"78","24","Вы не выиграли ещё.","You haven't won yet.","You, Your, Yours","You","haven't, hadn't, hasn't","haven't","won, win, winning, wins, winer, winned, wins'","won","yet, already, else, too, either, neither, or","yet","",".","","","","","","","","","",""
"79","24","Мы не встретились ещё.","We haven't met yet.","We, Our, Us, Ours","We","haven't, hadn't, hasn't","haven't","met, meet, meeting, meets, meeter, meetest, meeted, meetting","met","yet, already, else, too, either, neither, or","yet","",".","","","","","","","","","",""
"80","24","Я не сделал много.","I have not done much.","I, me, my, mine","I","have, had, has, having, haves, haveta, haveing, have led","have","not, no, none, neither, nore, nope","not","done, do, does, did, doing","done","much, more, most, muches","much","",".","","","","","","","",""
"81","24","Я не заплатил ещё.","I haven't paid yet.","I, me, my, mine","I","haven't, hadn't, hasn't","haven't","paid, pay, payer, paying, pays, payest, payed, payta","paid","yet, already, else, too, either, neither, or","yet","",".","","","","","","","","","",""
"82","24","Вы не жили ещё.","You haven't lived yet.","You, Your, Yours","You","haven't, hadn't, hasn't","haven't","lived, live, liver, lives, living, livest, liveing","lived","yet, already, else, too, either, neither, or","yet","",".","","","","","","","","","",""
"83","24","Мы не начинали ещё.","We haven't started yet.","We, Our, Us, Ours","We","haven't, hadn't, hasn't","haven't","started, start, starting, starts, startted, starttest, start'd","started","yet, already, else, too, either, neither, or","yet","",".","","","","","","","","","",""
"84","24","Я никогда не жил здесь!","I've never lived here!","I've, I'd, I'll, I'm","I've","never, nevers, never ming","never","lived, live, liver, lives, living, livest, liveing","lived","here, heres, hering, hered","here","","!","","","","","","","","","",""
"85","24","Вы не были здесь.","You haven't been here.","You, Your, Yours","You","haven't, hadn't, hasn't","haven't","been, is, be, are, was, were, will, shall","been","here, heres, hering, hered","here","",".","","","","","","","","","",""
"86","24","Я не начал ещё!","I haven't started yet!","I, me, my, mine","I","haven't, hadn't, hasn't","haven't","started, start, starting, starts, startted, starttest, start'd","started","yet, already, else, too, either, neither, or","yet","","!","","","","","","","","","",""
"87","24","Я никогда не работал там.","I've never worked there.","I've, I'd, I'll, I'm","I've","never, nevers, never ming","never","worked, work, working, works, wrought, workest","worked","there, theres, thered, thering","there","",".","","","","","","","","","",""
"88","24","Мы никогда не закрывались рано.","We've never closed early.","We've, We'd, We'll, We're","We've","never, nevers, never ming","never","closed, close, closing, closer, closes, closest, closeing, closes'","closed","early, earlier, earliest, earlied, earlys","early","",".","","","","","","","","","",""
"89","24","Я не спал много.","I haven't slept much.","I, me, my, mine","I","haven't, hadn't, hasn't","haven't","slept, sleep, sleeping, sleeps, sleepest, sleeped, sleepping, sleepped","slept","much, more, most, muches","much","",".","","","","","","","","","",""
"90","24","Ты не выздоровел ещё.","You haven't recovered yet.","You, Your, Yours","You","haven't, hadn't, hasn't","haven't","recovered, recover, recovering, recovers, recovers'","recovered","yet, already, else, too, either, neither, or","yet","",".","","","","","","","","","",""
