ID,Page ID,Local text,English text,Mix 1,Correct 1,Mix 2,Correct 2,Mix 3,Correct 3,Mix 4,Correct 4,Mix 5,Correct 5,Mix 6,Correct 6,Mix 7,Correct 7,Mix 8,Correct 8,Mix 9,Correct 9,Mix 10,Correct 10
"91","24","Я не слышал ни звука.","I have not heard a sound.","I, me, my, mine","I","have, had, has, having, haves, haveta, haveing, have led","have","not, no, none, neither, nore, nope","not","heard, hear, hearing, hears, horne, heared, hearther, hearred","heard","a, an","a","sound, sounder, sounding, sounds, sounded, soundest, soundbed","sound","",".","","","","","",""
"92","24","Вы не изменили историю.","You have not changed the story.","You, Your, Yours","You","have, had, has, having, haves, haveta, haveing, have led","have","not, no, none, neither, nore, nope","not","changed, change, changing, changes, changeing","changed","the, then, though","the","story, stories, storys, storying","story","",".","","","","","",""
"93","24","Вы не рассматривали альтернативу.","You have not considered the alternative.","You, Your, Yours","You","have, had, has, having, haves, haveta, haveing, have led","have","not, no, none, neither, nore, nope","not","considered, consider, considering, considers, considerest, consideri","considered","the, then, though","the","alternative, alternatives, alternative's, alternatives'","alternative","",".","","","","","",""
"94","24","Я никогда не рассказывал эту историю.","I have never told this story.","I, me, my, mine","I","have, had, has, having, haves, haveta, haveing, have led","have","never, nevers, never ming","never","told, tell, telling, tells, tellest, tollen","told","this, it'll, it's, its","this","story, stories, storys, storying","story","",".","","","","","",""
"95","24","У нас никогда не было машины.","We've never had a car.","We've, We'd, We'll, We're","We've","never, nevers, never ming","never","had, has, have, having, haves, haveta, haveing, have led","had","a, an","a","car, carer, cars, carring, carred","car","",".","","","","","","","",""
"96","24","Я не сделал ошибку.","I haven't made a mistake.","I, me, my, mine","I","haven't, hadn't, hasn't","haven't","made, make, making, makes, mook, maken, make  bed, makeing","made","a, an","a","mistake, mistaken, mistook, mistakes, mistaking, mistaked","mistake","",".","","","","","","","",""
"97","24","У меня никогда не было сомнения.","I've never had a doubt","I've, I'd, I'll, I'm","I've","never, nevers, never ming","never","had, has, have, having, haves, haveta, haveing, have led","had","a, an","a","doubt, doubting, doubted, doubts, doubtest","doubt","","","","","","","","","",""
"98","24","Я не курил весь день.","I haven't smoked all day.","I, me, my, mine","I","haven't, hadn't, hasn't","haven't","smoked, smoke, smoking, smokes, smokeing, smokes'","smoked","all, allbest, alls'","all","day, days, daid, daies, daybed, daybest, daying, dayta","day","",".","","","","","","","",""
"99","24","Я никогда не слышал это имя.","I've never heard this name.","I've, I'd, I'll, I'm","I've","never, nevers, never ming","never","heard, hear, hearing, hears, horne, heared, hearther, hearred","heard","this, it'll, it's, its","this","name, names, named, naming, namest, namer","name","",".","","","","","","","",""
"100","24","Я не слышал ни слова.","I haven't heard a word.","I, me, my, mine","I","haven't, hadn't, hasn't","haven't","heard, hear, hearing, hears, horne, heared, hearther, hearred","heard","a, an","a","word, wording, words, worded","word","",".","","","","","","","",""
"101","24","Я никогда не пропускал шоу.","I've never missed a show.","I've, I'd, I'll, I'm","I've","never, nevers, never ming","never","missed, miss, missing, misses, misser","missed","a, an","a","show, shower, showing, shown, showed, shows, showest","show","",".","","","","","","","",""
"102","24","У нас никогда не было проблемы.","We've never had a problem.","We've, We'd, We'll, We're","We've","never, nevers, never ming","never","had, has, have, having, haves, haveta, haveing, have led","had","a, an","a","problem, problems, problematic","problem","",".","","","","","","","",""
"103","24","Я никогда не видел эту часть.","I've never seen this part.","I've, I'd, I'll, I'm","I've","never, nevers, never ming","never","seen, saw, see, seeing, sees, seemest, seeger, seeta","seen","this, it'll, it's, its","this","part, parted, parting, parts, parter","part","",".","","","","","","","",""
"104","24","Я никогда не видел эту девушку.","I've never seen this girl.","I've, I'd, I'll, I'm","I've","never, nevers, never ming","never","seen, saw, see, seeing, sees, seemest, seeger, seeta","seen","this, it'll, it's, its","this","girl, girls, girled","girl","",".","","","","","","","",""
"105","24","Я никогда не видел моря.","I've never seen the sea.","I've, I'd, I'll, I'm","I've","never, nevers, never ming","never","seen, saw, see, seeing, sees, seemest, seeger, seeta","seen","the, then, though","the","sea, seas, seae, sea bed","sea","",".","","","","","","","",""
"106","24","Вы не съели ни кусочка.","You haven't eaten a bite.","You, Your, Yours","You","haven't, hadn't, hasn't","haven't","eaten, ate, eat, eating, eats, eatest, eated, eatting","eaten","a, an","a","bite, bit, biting, bitten, bites, bote","bite","",".","","","","","","","",""
"107","24","Я не пропустил другой урок.","I haven't skipped another class.","I, me, my, mine","I","haven't, hadn't, hasn't","haven't","skipped, skip, skipping, skips, skiped, skipp'd","skipped","another, anothers, anotheria","another","class, classes, classed, classing, classer","class","",".","","","","","","","",""
"108","24","Я никогда не проигрывал игру.","I've never lost a game.","I've, I'd, I'll, I'm","I've","never, nevers, never ming","never","lost, lose, losing, loses, losest, losed, loseing","lost","a, an","a","game, games, gamed, gaming, gamest, gamer, gameren, gameing","game","",".","","","","","","","",""
"109","24","Мы не покидали лагерь.","We haven't left the camp.","We, Our, Us, Ours","We","haven't, hadn't, hasn't","haven't","left, leave, leaves, leaving, leavest, loven, leav'd","left","the, then, though","the","camp, camper, camping, camped, camps, campbed, camp bed, campest","camp","",".","","","","","","","",""
"110","24","Я не звонил в офис.","I haven't called the office.","I, me, my, mine","I","haven't, hadn't, hasn't","haven't","called, call, calling, calls, callest, callled","called","the, then, though","the","office, offices, officed, officing, offices'","office","",".","","","","","","","",""
"111","24","Вы не подписали письмо.","You haven't signed the letter.","You, Your, Yours","You","haven't, hadn't, hasn't","haven't","signed, sign, signs, signing","signed","the, then, though","the","letter, lettered, lettering, letters, lettera, letter'd","letter","",".","","","","","","","",""
"112","24","Я никогда не видел ружьё.","I have never seen a gun.","I, me, my, mine","I","have, had, has, having, haves, haveta, haveing, have led","have","never, nevers, never ming","never","seen, saw, see, seeing, sees, seemest, seeger, seeta","seen","a, an","a","gun, gunning, guns, gunned","gun","",".","","","","","",""
"113","24","Я не сделал никакую работу.","I haven't done any work.","I, me, my, mine","I","haven't, hadn't, hasn't","haven't","done, do, does, did, doing","done","any, anys, anyming, anying, anies","any","work, working, works, wrought, worked, workest","work","",".","","","","","","","",""
"114","24","Мы не слышали никаких новостей.","We haven't heard any news.","We, Our, Us, Ours","We","haven't, hadn't, hasn't","haven't","heard, hear, hearing, hears, horne, heared, hearther, hearred","heard","any, anys, anyming, anying, anies","any","news, newspapers, newscaster, newsstand, newsletter, newspaper","news","",".","","","","","","","",""
"115","24","Я не видел этого платья.","I haven't seen this dress.","I, me, my, mine","I","haven't, hadn't, hasn't","haven't","seen, saw, see, seeing, sees, seemest, seeger, seeta","seen","this, it'll, it's, its","this","dress, dresser, dressing, dressed, dresses, dresses'","dress","",".","","","","","","","",""
"116","24","Я никогда не носил часы.","I've never worn a watch.","I've, I'd, I'll, I'm","I've","never, nevers, never ming","never","worn, wear, wearing, wore, wears, worne, weared, weard","worn","a, an","a","watch, watching, watches, watched, watchs, watches'","watch","",".","","","","","","","",""
"117","24","Я не проходил тест.","I haven't taken a test.","I, me, my, mine","I","haven't, hadn't, hasn't","haven't","taken, take, taking, took, takes, taketa, taked, takeing","taken","a, an","a","test, testing, tested, tests, testbed, testtest, test bed","test","",".","","","","","","","",""
"118","24","Мы не нашли никаких денег.","We haven't found any money.","We, Our, Us, Ours","We","haven't, hadn't, hasn't","haven't","found, find, finding, finds, findest, finded, finds'","found","any, anys, anyming, anying, anies","any","money, monetary","money","",".","","","","","","","",""
"119","24","Вы не выбрали цвет.","You haven't chosen a colour.","You, Your, Yours","You","haven't, hadn't, hasn't","haven't","chosen, choose, chose, chooses, choosing, choosest, choosed","chosen","a, an","a","colour, coloured, colouring, colours","colour","",".","","","","","","","",""
"120","24","Вы не слышали вопроса!","You've not heard the question!","You've, You'd, You'll, You're","You've","not, no, none, neither, nore, nope","not","heard, hear, hearing, hears, horne, heared, hearther, hearred","heard","the, then, though","the","question, questioning, questions, questioned, questionning","question","","!","","","","","","","",""
"121","24","Мы не звонили в полицию.","We haven't called the police.","We, Our, Us, Ours","We","haven't, hadn't, hasn't","haven't","called, call, calling, calls, callest, callled","called","the, then, though","the","police, policing, polices, policed","police","",".","","","","","","","",""
"122","24","Я никогда не видел океан!","I've never seen the ocean!","I've, I'd, I'll, I'm","I've","never, nevers, never ming","never","seen, saw, see, seeing, sees, seemest, seeger, seeta","seen","the, then, though","the","ocean, oceans, oceaner","ocean","","!","","","","","","","",""
"123","24","У меня никогда не было собаки.","I've never had a dog.","I've, I'd, I'll, I'm","I've","never, nevers, never ming","never","had, has, have, having, haves, haveta, haveing, have led","had","a, an","a","dog, dogged, dogs, dogging, dogbed","dog","",".","","","","","","","",""
"124","24","Ты не потерял никаких денег.","You haven't lost any money.","You, Your, Yours","You","haven't, hadn't, hasn't","haven't","lost, lose, losing, loses, losest, losed, loseing","lost","any, anys, anyming, anying, anies","any","money, monetary","money","",".","","","","","","","",""
"125","24","Я не видел никакого хлеба.","I haven't seen any bread.","I, me, my, mine","I","haven't, hadn't, hasn't","haven't","seen, saw, see, seeing, sees, seemest, seeger, seeta","seen","any, anys, anyming, anying, anies","any","bread, breaded, breads, breading, breader","bread","",".","","","","","","","",""
"126","24","Вы никогда не пропускали приём.","You've never missed an appointment.","You've, You'd, You'll, You're","You've","never, nevers, never ming","never","missed, miss, missing, misses, misser","missed","an, a","an","appointment, appointments, appointments'","appointment","",".","","","","","","","",""
"127","24","Вы не видели этот закат.","You have not seen this sunset.","You, Your, Yours","You","have, had, has, having, haves, haveta, haveing, have led","have","not, no, none, neither, nore, nope","not","seen, saw, see, seeing, sees, seemest, seeger, seeta","seen","this, it'll, it's, its","this","sunset, sunsets, sunsetting, sunsetted, sunsets'","sunset","",".","","","","","",""
"128","24","Я не видел фильм.","I haven't seen the movie.","I, me, my, mine","I","haven't, hadn't, hasn't","haven't","seen, saw, see, seeing, sees, seemest, seeger, seeta","seen","the, then, though","the","movie, movies, moving, movin","movie","",".","","","","","","","",""
"129","24","У меня никогда не было домашнего животного.","I've never had a pet.","I've, I'd, I'll, I'm","I've","never, nevers, never ming","never","had, has, have, having, haves, haveta, haveing, have led","had","a, an","a","pet, petting, pets, petted, peted, petter, potten, petren","pet","",".","","","","","","","",""
"130","24","Вы не открыли дверь.","You haven't opened the door","You, Your, Yours","You","haven't, hadn't, hasn't","haven't","opened, open, opening, opens, openest, openned, openning, opens'","opened","the, then, though","the","door, doors, doored","door","","","","","","","","","",""
"131","24","Я не совершал никакого преступления.","I have not committed any crime.","I, me, my, mine","I","have, had, has, having, haves, haveta, haveing, have led","have","not, no, none, neither, nore, nope","not","committed, commit, commits, committing, commited, commiting","committed","any, anys, anyming, anying, anies","any","crime, crimes, criming, crimed","crime","",".","","","","","",""
"132","24","Ты не смотрел новости.","You haven't watched the news","You, Your, Yours","You","haven't, hadn't, hasn't","haven't","watched, watch, watching, watches, watchs, watches'","watched","the, then, though","the","news, newspapers, newscaster, newsstand, newsletter, newspaper","news","","","","","","","","","",""
"133","24","Мне никогда не нравился район.","I've never liked the neighborhood.","I've, I'd, I'll, I'm","I've","never, nevers, never ming","never","liked, like, liking, likes, likest, liker, licken, likeing","liked","the, then, though","the","neighborhood, neighborhoods, neighborhoods'","neighborhood","",".","","","","","","","",""
"134","24","Вы никогда не встречали этого парня.","You've never met this guy.","You've, You'd, You'll, You're","You've","never, nevers, never ming","never","met, meet, meeting, meets, meeter, meetest, meeted, meetting","met","this, it'll, it's, its","this","guy, guys, guyed, guying, guier, guies, guied","guy","",".","","","","","","","",""
"135","24","Я никогда не видел этот отчёт.","I've never seen this report.","I've, I'd, I'll, I'm","I've","never, nevers, never ming","never","seen, saw, see, seeing, sees, seemest, seeger, seeta","seen","this, it'll, it's, its","this","report, reported, reports, reporting","report","",".","","","","","","","",""
"136","24","Вы не написали книгу!","You haven't written a book!","You, Your, Yours","You","haven't, hadn't, hasn't","haven't","written, wrote, write, writing, writes, writeing, writes', write's","written","a, an","a","book, booked, booking, booker, books","book","","!","","","","","","","",""
"137","24","Вы не видели собаку.","You haven't seen a dog.","You, Your, Yours","You","haven't, hadn't, hasn't","haven't","seen, saw, see, seeing, sees, seemest, seeger, seeta","seen","a, an","a","dog, dogged, dogs, dogging, dogbed","dog","",".","","","","","","","",""
"138","24","Вы не ели целый день.","You haven't eaten all day.","You, Your, Yours","You","haven't, hadn't, hasn't","haven't","eaten, ate, eat, eating, eats, eatest, eated, eatting","eaten","all, allbest, alls'","all","day, days, daid, daies, daybed, daybest, daying, dayta","day","",".","","","","","","","",""
"139","24","Я не написал ни слова.","I haven't written a word.","I, me, my, mine","I","haven't, hadn't, hasn't","haven't","written, wrote, write, writing, writes, writeing, writes', write's","written","a, an","a","word, wording, words, worded","word","",".","","","","","","","",""
"140","24","Я никогда не видел младенца.","I've never seen a baby.","I've, I'd, I'll, I'm","I've","never, nevers, never ming","never","seen, saw, see, seeing, sees, seemest, seeger, seeta","seen","a, an","a","baby, babies, babied, babys, babying, babiest","baby","",".","","","","","","","",""
"141","24","Вы не слышали новости.","You haven't heard the news.","You, Your, Yours","You","haven't, hadn't, hasn't","haven't","heard, hear, hearing, hears, horne, heared, hearther, hearred","heard","the, then, though","the","news, newspapers, newscaster, newsstand, newsletter, newspaper","news","",".","","","","","","","",""
"142","24","У меня никогда не было возможности.","I have never had the opportunity.","I, me, my, mine","I","have, had, has, having, haves, haveta, haveing, have led","have","never, nevers, never ming","never","had, has, have, having, haves, haveta, haveing, have led","had","the, then, though","the","opportunity, opportune, opposition, opponent, oppose, opposite","opportunity","",".","","","","","",""
"143","24","У меня никогда не было паспорта.","I've never had a passport.","I've, I'd, I'll, I'm","I've","never, nevers, never ming","never","had, has, have, having, haves, haveta, haveing, have led","had","a, an","a","passport, passports, passports'","passport","",".","","","","","","","",""
"144","24","Мы не нашли нож.","We haven't found the knife.","We, Our, Us, Ours","We","haven't, hadn't, hasn't","haven't","found, find, finding, finds, findest, finded, finds'","found","the, then, though","the","knife, knives, knifing, knifed, knifes, knifeing","knife","",".","","","","","","","",""
"145","24","Я не приносил часы.","I haven't brought the watch.","I, me, my, mine","I","haven't, hadn't, hasn't","haven't","brought, bring, bringing, brings, brung, bringed","brought","the, then, though","the","watch, watching, watches, watched, watchs, watches'","watch","",".","","","","","","","",""
"146","24","Я никогда не видел пустыню.","I've never seen the desert.","I've, I'd, I'll, I'm","I've","never, nevers, never ming","never","seen, saw, see, seeing, sees, seemest, seeger, seeta","seen","the, then, though","the","desert, deserted, deserts, deserting, desertest, deserts'","desert","",".","","","","","","","",""
"147","24","У меня никогда не было друга.","I've never had a friend.","I've, I'd, I'll, I'm","I've","never, nevers, never ming","never","had, has, have, having, haves, haveta, haveing, have led","had","a, an","a","friend, friends, friending, friended","friend","",".","","","","","","","",""
"148","24","Я никогда не видел шоу.","I've never seen the show.","I've, I'd, I'll, I'm","I've","never, nevers, never ming","never","seen, saw, see, seeing, sees, seemest, seeger, seeta","seen","the, then, though","the","show, shower, showing, shown, showed, shows, showest","show","",".","","","","","","","",""
"149","24","У тебя никогда не было жены.","You've never had a wife.","You've, You'd, You'll, You're","You've","never, nevers, never ming","never","had, has, have, having, haves, haveta, haveing, have led","had","a, an","a","wife, wives, wifes, wifed, wifing","wife","",".","","","","","","","",""
"150","24","Я не слышал эту шутку.","I have not heard this joke.","I, me, my, mine","I","have, had, has, having, haves, haveta, haveing, have led","have","not, no, none, neither, nore, nope","not","heard, hear, hearing, hears, horne, heared, hearther, hearred","heard","this, it'll, it's, its","this","joke, jokes, joked, joking, jokeing","joke","",".","","","","","",""
"151","24","Я никогда не был этим человеком.","I've never been this person.","I've, I'd, I'll, I'm","I've","never, nevers, never ming","never","been, is, be, are, was, were, will, shall","been","this, it'll, it's, its","this","person, people, persons, personed, personing","person","",".","","","","","","","",""
"152","24","Я никогда не видел рассвет.","I've never seen the sunrise.","I've, I'd, I'll, I'm","I've","never, nevers, never ming","never","seen, saw, see, seeing, sees, seemest, seeger, seeta","seen","the, then, though","the","sunrise, sunrises, sunrising, sunrise's","sunrise","",".","","","","","","","",""
"153","24","Я никогда не видел гору.","I have never seen a mountain.","I, me, my, mine","I","have, had, has, having, haves, haveta, haveing, have led","have","never, nevers, never ming","never","seen, saw, see, seeing, sees, seemest, seeger, seeta","seen","a, an","a","mountain, mountains, mountained, mountainer","mountain","",".","","","","","",""
"154","24","Я никогда не видел кенгуру.","I've never seen a kangaroo.","I've, I'd, I'll, I'm","I've","never, nevers, never ming","never","seen, saw, see, seeing, sees, seemest, seeger, seeta","seen","a, an","a","kangaroo, kangaroos, kangarooed, kangaroos'","kangaroo","",".","","","","","","","",""
"155","24","Мы не уходили из дома.","We haven't left the house.","We, Our, Us, Ours","We","haven't, hadn't, hasn't","haven't","left, leave, leaves, leaving, leavest, loven, leav'd","left","the, then, though","the","house, housing, houses, housed, hous'd","house","",".","","","","","","","",""
"156","24","Мы не приняли решение.","We haven't made a decision.","We, Our, Us, Ours","We","haven't, hadn't, hasn't","haven't","made, make, making, makes, mook, maken, make  bed, makeing","made","a, an","a","decision, decisions, decisioning, decisions'","decision","",".","","","","","","","",""
"157","24","Я не слышал эту песню.","I haven't heard this song","I, me, my, mine","I","haven't, hadn't, hasn't","haven't","heard, hear, hearing, hears, horne, heared, hearther, hearred","heard","this, it'll, it's, its","this","song, songs, songed, songer","song","","","","","","","","","",""
"158","24","Вы никогда не задавали вопрос.","You've never asked the question.","You've, You'd, You'll, You're","You've","never, nevers, never ming","never","asked, ask, asking, asks, askest, asks'","asked","the, then, though","the","question, questioning, questions, questioned, questionning","question","",".","","","","","","","",""
"159","24","Я никогда не был проигравшим.","I have never been a loser.","I, me, my, mine","I","have, had, has, having, haves, haveta, haveing, have led","have","never, nevers, never ming","never","been, is, be, are, was, were, will, shall","been","a, an","a","loser, lose","loser","",".","","","","","",""
"160","24","У меня никогда не было бороды.","I've never had a beard.","I've, I'd, I'll, I'm","I've","never, nevers, never ming","never","had, has, have, having, haves, haveta, haveing, have led","had","a, an","a","beard, bearded, beards, bearding, beards'","beard","",".","","","","","","","",""
"161","24","Я никогда не пропускал открытие.","I've never missed an opening.","I've, I'd, I'll, I'm","I've","never, nevers, never ming","never","missed, miss, missing, misses, misser","missed","an, a","an","opening, openings, openings'","opening","",".","","","","","","","",""
"162","24","Я не спал на этой неделе.","I haven't slept this week.","I, me, my, mine","I","haven't, hadn't, hasn't","haven't","slept, sleep, sleeping, sleeps, sleepest, sleeped, sleepping, sleepped","slept","this, it'll, it's, its","this","week, weeks, weeked","week","",".","","","","","","","",""
"163","24","Я никогда не праздновал день рождения.","I've never celebrated a birthday.","I've, I'd, I'll, I'm","I've","never, nevers, never ming","never","celebrated, celebrate, celebrates, celebrating","celebrated","a, an","a","birthday, birthmark, birthplace, birthright, birth","birthday","",".","","","","","","","",""
"164","24","Я никогда не была подружкой невесты.","I've never been a bridesmaid.","I've, I'd, I'll, I'm","I've","never, nevers, never ming","never","been, is, be, are, was, were, will, shall","been","a, an","a","bridesmaid, bridegroom, bride","bridesmaid","",".","","","","","","","",""
"165","24","Я не видел врача.","I haven't seen a doctor.","I, me, my, mine","I","haven't, hadn't, hasn't","haven't","seen, saw, see, seeing, sees, seemest, seeger, seeta","seen","a, an","a","doctor, doctors, doctoring, doctored","doctor","",".","","","","","","","",""
"166","24","Я никогда не ездил на лошади.","I've never ridden a horse.","I've, I'd, I'll, I'm","I've","never, nevers, never ming","never","ridden, ride, riding, rode, rides, ridest, rided, rideing","ridden","a, an","a","horse, horsing, horses, horsed, horser, hors'd","horse","",".","","","","","","","",""
"167","24","Мы не оплатили счёт.","We haven't paid the bill.","We, Our, Us, Ours","We","haven't, hadn't, hasn't","haven't","paid, pay, payer, paying, pays, payest, payed, payta","paid","the, then, though","the","bill, bills, billing, billed, biller, bill'd","bill","",".","","","","","","","",""
