ID,Page ID,Local text,English text,Mix 1,Correct 1,Mix 2,Correct 2,Mix 3,Correct 3,Mix 4,Correct 4,Mix 5,Correct 5,Mix 6,Correct 6,Mix 7,Correct 7,Mix 8,Correct 8,Mix 9,Correct 9,Mix 10,Correct 10
"1","78","Какой хороший учитель.","What a good teacher.","What, Where, When, Why, Who","What","a, an","a","good, best, better, goods, gooding, goodest","good","teacher, teaching, teach","teacher","",".","","","","","","","","","",""
"2","78","Какой хороший парень!","What a good guy!","What, Where, When, Why, Who","What","a, an","a","good, best, better, goods, gooding, goodest","good","guy, guys, guyed, guying, guier, guies, guied","guy","","!","","","","","","","","","",""
"3","78","Какая большая комната!","What a big room!","What, Where, When, Why, Who","What","a, an","a","big, biggest, bigger, bigs, bigging, bigest","big","room, rooms, roomed, rooming, roomin'","room","","!","","","","","","","","","",""
"4","78","Какая милая женщина!","What a nice woman!","What, Where, When, Why, Who","What","a, an","a","nice, nicer, nicest, nices","nice","woman, women, womaning, womans, womaned","woman","","!","","","","","","","","","",""
"5","78","Какой фантастический вид.","What a fantastic view.","What, Where, When, Why, Who","What","a, an","a","fantastic, fantastical, fantastically","fantastic","view, views, viewed, viewing, viewest, viewin'","view","",".","","","","","","","","","",""
"6","78","Какое красивое платье!","What a beautiful dress!","What, Where, When, Why, Who","What","a, an","a","beautiful, beautifulest, beautifuls","beautiful","dress, dresser, dressing, dressed, dresses, dresses'","dress","","!","","","","","","","","","",""
"7","78","У меня есть билет.","I've got a ticket.","I've, I'd, I'll, I'm","I've","got, get, gotten, getting, gets, gettest, geted, gets'","got","a, an","a","ticket, tickets, ticketed, ticketing, tickets'","ticket","",".","","","","","","","","","",""
"8","78","У меня есть собака.","I've got a dog.","I've, I'd, I'll, I'm","I've","got, get, gotten, getting, gets, gettest, geted, gets'","got","a, an","a","dog, dogged, dogs, dogging, dogbed","dog","",".","","","","","","","","","",""
"9","78","У меня есть идея!","I've got an idea!","I've, I'd, I'll, I'm","I've","got, get, gotten, getting, gets, gettest, geted, gets'","got","an, a","an","idea, idealist, idealism, idealize, idealistic, ideally, ideal","idea","","!","","","","","","","","","",""
"10","78","У меня есть комната.","I've got a room.","I've, I'd, I'll, I'm","I've","got, get, gotten, getting, gets, gettest, geted, gets'","got","a, an","a","room, rooms, roomed, rooming, roomin'","room","",".","","","","","","","","","",""
"11","78","У меня есть друг!","I've got a friend!","I've, I'd, I'll, I'm","I've","got, get, gotten, getting, gets, gettest, geted, gets'","got","a, an","a","friend, friends, friending, friended","friend","","!","","","","","","","","","",""
"12","78","У меня есть семья.","I've got a family.","I've, I'd, I'll, I'm","I've","got, get, gotten, getting, gets, gettest, geted, gets'","got","a, an","a","family, families, familys, familier","family","",".","","","","","","","","","",""
"13","78","У меня есть работа.","I've got a job.","I've, I'd, I'll, I'm","I've","got, get, gotten, getting, gets, gettest, geted, gets'","got","a, an","a","job, jobber, jobbing, jobs, jobbed","job","",".","","","","","","","","","",""
"14","78","У нас есть проблема.","We've got a problem.","We've, We'd, We'll, We're","We've","got, get, gotten, getting, gets, gettest, geted, gets'","got","a, an","a","problem, problems, problematic","problem","",".","","","","","","","","","",""
"15","78","У меня есть компьютер.","I've got a computer.","I've, I'd, I'll, I'm","I've","got, get, gotten, getting, gets, gettest, geted, gets'","got","a, an","a","computer, computerize, compute","computer","",".","","","","","","","","","",""
"16","78","У меня есть вопрос.","I've got a question.","I've, I'd, I'll, I'm","I've","got, get, gotten, getting, gets, gettest, geted, gets'","got","a, an","a","question, questioning, questions, questioned, questionning","question","",".","","","","","","","","","",""
"17","78","У меня есть работа!","I've got a job!","I've, I'd, I'll, I'm","I've","got, get, gotten, getting, gets, gettest, geted, gets'","got","a, an","a","job, jobber, jobbing, jobs, jobbed","job","","!","","","","","","","","","",""
"18","78","Я не ученик.","I am not a pupil.","I, me, my, mine","I","am, are, be, been, being, is, was, were","am","not, no, none, neither, nore, nope","not","a, an","a","pupil, pupils","pupil","",".","","","","","","","",""
"19","78","Мы не семья.","We're not a family.","We're, We'd, We'll, We've","We're","not, no, none, neither, nore, nope","not","a, an","a","family, families, familys, familier","family","",".","","","","","","","","","",""
"20","78","Ты не ребёнок.","You are not a child.","You, Your, Yours","You","are, is, be, been, was, were, will, shall","are","not, no, none, neither, nore, nope","not","a, an","a","child, children, childs, childer, chilt","child","",".","","","","","","","",""
"21","78","Я не повар.","I'm not a cook.","I'm, I'd, I'll, I've","I'm","not, no, none, neither, nore, nope","not","a, an","a","cook, cooked, cooking, cooks","cook","",".","","","","","","","","","",""
"22","78","Он был замечательным пилотом.","He was a great pilot.","He, Him, His, It, Its","He","was, is, be, been, are, were, will, shall","was","a, an","a","great, greater, greats, greatest, greated, greating, greatter, greats'","great","pilot, pilots, piloted, piloting, pilot'd","pilot","",".","","","","","","","",""
"23","78","Я не писатель.","I'm not a writer.","I'm, I'd, I'll, I've","I'm","not, no, none, neither, nore, nope","not","a, an","a","writer, writers, writeri","writer","",".","","","","","","","","","",""
"24","78","Мы не команда.","We are not a team.","We, Our, Us, Ours","We","are, is, be, been, was, were, will, shall","are","not, no, none, neither, nore, nope","not","a, an","a","team, teams, teaming, teamed, teamin', team'd","team","",".","","","","","","","",""
"25","78","Я не пассажир!","I am not a passenger!","I, me, my, mine","I","am, are, be, been, being, is, was, were","am","not, no, none, neither, nore, nope","not","a, an","a","passenger, passes, passengers, passed, passerby, passer","passenger","","!","","","","","","","",""
"26","78","У меня был ужасный день.","I had a terrible day.","I, me, my, mine","I","had, has, have, having, haves, haveta, haveing, have led","had","a, an","a","terrible, terribles, terribler, terribled","terrible","day, days, daid, daies, daybed, daybest, daying, dayta","day","",".","","","","","","","",""
"27","78","Он был великим писателем.","He was a great writer","He, Him, His, It, Its","He","was, is, be, been, are, were, will, shall","was","a, an","a","great, greater, greats, greatest, greated, greating, greatter, greats'","great","writer, writers, writeri","writer","","","","","","","","","",""
"28","78","Это было короткое письмо.","It was a short letter.","It, He, Him, His, Its","It","was, is, be, been, are, were, will, shall","was","a, an","a","short, shorts, shorter, shortest, shorted, shorting, shorts'","short","letter, lettered, lettering, letters, lettera, letter'd","letter","",".","","","","","","","",""
"29","78","Я слышал другую историю.","I heard a different story.","I, me, my, mine","I","heard, hear, hearing, hears, horne, heared, hearther, hearred","heard","a, an","a","different, differentiation, differential, differentiate, differently","different","story, stories, storys, storying","story","",".","","","","","","","",""
"30","78","Он был плохим человеком.","He was a bad man.","He, Him, His, It, Its","He","was, is, be, been, are, were, will, shall","was","a, an","a","bad, worse, worst, baddest, bads, bader, badest","bad","man, manned, manning, men, maning, mans, maned, maner","man","",".","","","","","","","",""
"31","78","У меня была любящая семья.","I had a loving family.","I, me, my, mine","I","had, has, have, having, haves, haveta, haveing, have led","had","a, an","a","loving, lovin, lovingly","loving","family, families, familys, familier","family","",".","","","","","","","",""
"32","78","Ты был красивым мальчиком.","You were a beautiful boy.","You, Your, Yours","You","were, is, be, been, are, was, will, shall","were","a, an","a","beautiful, beautifulest, beautifuls","beautiful","boy, boys, boies, boyling, boyed, boying","boy","",".","","","","","","","",""
"33","78","Это был прекрасный день.","It was a beautiful day.","It, He, Him, His, Its","It","was, is, be, been, are, were, will, shall","was","a, an","a","beautiful, beautifulest, beautifuls","beautiful","day, days, daid, daies, daybed, daybest, daying, dayta","day","",".","","","","","","","",""
"34","78","Он был странным мальчиком.","He was a strange boy.","He, Him, His, It, Its","He","was, is, be, been, are, were, will, shall","was","a, an","a","strange, stranger, strangest, stranges, stranged","strange","boy, boys, boies, boyling, boyed, boying","boy","",".","","","","","","","",""
"35","78","Он увидел старушку.","He saw an old woman.","He, Him, His, It, Its","He","saw, sawn, saws, sawing, sawed, sawest, sawer, saws'","saw","an, a","an","old, elder, eldest, oldest, older, olds, olding","old","woman, women, womaning, womans, womaned","woman","",".","","","","","","","",""
"36","78","Это был долгий перелёт.","It was a long flight.","It, He, Him, His, Its","It","was, is, be, been, are, were, will, shall","was","a, an","a","long, longer, longest, longing, longed, longs, longbed, long bed","long","flight, flights, flighting, flighted, flighter, flightin'","flight","",".","","","","","","","",""
"37","78","Это был большой остров.","It was a large island.","It, He, Him, His, Its","It","was, is, be, been, are, were, will, shall","was","a, an","a","large, largest, larger, larges, larged, larging","large","island, islands, islanded, islanding","island","",".","","","","","","","",""
"38","78","Это была длинная книга.","It was a long book.","It, He, Him, His, Its","It","was, is, be, been, are, were, will, shall","was","a, an","a","long, longer, longest, longing, longed, longs, longbed, long bed","long","book, booked, booking, booker, books","book","",".","","","","","","","",""
"39","78","Он был хорошим братом.","He was a good brother.","He, Him, His, It, Its","He","was, is, be, been, are, were, will, shall","was","a, an","a","good, best, better, goods, gooding, goodest","good","brother, brethren, brothers, brothering","brother","",".","","","","","","","",""
"40","78","Это был чудесный корабль.","It was a wonderful ship.","It, He, Him, His, Its","It","was, is, be, been, are, were, will, shall","was","a, an","a","wonderful, wonderfulest, wonderfuls","wonderful","ship, shipping, ships, shipped, shiped","ship","",".","","","","","","","",""
"41","78","У него была хорошая песня.","He had a good song.","He, Him, His, It, Its","He","had, has, have, having, haves, haveta, haveing, have led","had","a, an","a","good, best, better, goods, gooding, goodest","good","song, songs, songed, songer","song","",".","","","","","","","",""
"42","78","Это был великолепный план.","It was a brilliant plan.","It, He, Him, His, Its","It","was, is, be, been, are, were, will, shall","was","a, an","a","brilliant, brilliants, brilliantest, brilliants'","brilliant","plan, planned, plans, planning","plan","",".","","","","","","","",""
"43","78","Это был чудесный момент.","It was a wonderful moment.","It, He, Him, His, Its","It","was, is, be, been, are, were, will, shall","was","a, an","a","wonderful, wonderfulest, wonderfuls","wonderful","moment, moments, momentous, momentary, momentarily, momentum","moment","",".","","","","","","","",""
"44","78","Мой сын был певцом.","My son was a singer.","My, I, Me, Mine","My","son, sons, sonning, soned, sonned, soning","son","was, is, be, been, are, were, will, shall","was","a, an","a","singer, sings, singin, singing, singly, singsong, singularity, singularly","singer","",".","","","","","","","",""
"45","78","Моя мама была учительницей.","My mom was a teacher.","My, I, Me, Mine","My","mom, moms, mommed, moming, moms'","mom","was, is, be, been, are, were, will, shall","was","a, an","a","teacher, teaching, teach","teacher","",".","","","","","","","",""
"46","78","Моя мама была писательницей.","My mom was a writer.","My, I, Me, Mine","My","mom, moms, mommed, moming, moms'","mom","was, is, be, been, are, were, will, shall","was","a, an","a","writer, writers, writeri","writer","",".","","","","","","","",""
"47","78","Мой отец был спортсменом.","My father was a sportsman.","My, I, Me, Mine","My","father, fathers, fathered, fathering","father","was, is, be, been, are, were, will, shall","was","a, an","a","sportsman, sportsmen, sportsmans, sportsmens","sportsman","",".","","","","","","","",""
"48","78","Твоя мама упаковала сумку.","Your mom packed a bag.","Your, You, Yours","Your","mom, moms, mommed, moming, moms'","mom","packed, pack, packing, packs, packs'","packed","a, an","a","bag, bagged, bagging, bags","bag","",".","","","","","","","",""
"49","78","Её отец был врачом.","Her father was a doctor.","Her, She, Hers","Her","father, fathers, fathered, fathering","father","was, is, be, been, are, were, will, shall","was","a, an","a","doctor, doctors, doctoring, doctored","doctor","",".","","","","","","","",""
"50","78","Ты хороший друг.","You're a good friend.","You're, You'd, You'll, You've","You're","a, an","a","good, best, better, goods, gooding, goodest","good","friend, friends, friending, friended","friend","",".","","","","","","","","","",""
"51","78","У моего отца была лодка.","My father had a boat.","My, I, Me, Mine","My","father, fathers, fathered, fathering","father","had, has, have, having, haves, haveta, haveing, have led","had","a, an","a","boat, boating, boats, boated, boatin'","boat","",".","","","","","","","",""
"52","78","Ваш муж оставил сообщение.","Your husband left a message","Your, You, Yours","Your","husband, husbands, husbanding, husbanded","husband","left, leave, leaves, leaving, leavest, loven, leav'd","left","a, an","a","message, messages, messager, messaging, messaged","message","","","","","","","","","",""
"53","78","Моя жена была актрисой.","My wife was an actress.","My, I, Me, Mine","My","wife, wives, wifes, wifed, wifing","wife","was, is, be, been, are, were, will, shall","was","an, a","an","actress, actresses, actressing, actresses'","actress","",".","","","","","","","",""
"54","78","Мой отец нашёл работу.","My father found a job.","My, I, Me, Mine","My","father, fathers, fathered, fathering","father","found, find, finding, finds, findest, finded, finds'","found","a, an","a","job, jobber, jobbing, jobs, jobbed","job","",".","","","","","","","",""
"55","78","Мой папа написал песню.","My dad wrote a song.","My, I, Me, Mine","My","dad, dads","dad","wrote, write, writing, written, writes, writeing, writes', write's","wrote","a, an","a","song, songs, songed, songer","song","",".","","","","","","","",""
"56","78","У нас есть работа для вас.","We have a job for you.","We, Our, Us, Ours","We","have, had, has, having, haves, haveta, haveing, have led","have","a, an","a","job, jobber, jobbing, jobs, jobbed","job","for, on, in, at, since, ago, before, to","for","you, your, yours","you","",".","","","","","",""
"57","78","У меня сюрприз для них.","I have a surprise for them.","I, me, my, mine","I","have, had, has, having, haves, haveta, haveing, have led","have","a, an","a","surprise, surprising, surprised, surprises, surpriseing, surprise's","surprise","for, on, in, at, since, ago, before, to","for","them, they, their, theirs","them","",".","","","","","",""
"58","78","У меня есть задача для него.","I have a task for him.","I, me, my, mine","I","have, had, has, having, haves, haveta, haveing, have led","have","a, an","a","task, tasks, tasked, tasking, task'd, tasks'","task","for, on, in, at, since, ago, before, to","for","him, he, his, it, its","him","",".","","","","","",""
"59","78","У нас сообщение для вас.","We have a message for you","We, Our, Us, Ours","We","have, had, has, having, haves, haveta, haveing, have led","have","a, an","a","message, messages, messager, messaging, messaged","message","for, on, in, at, since, ago, before, to","for","you, your, yours","you","","","","","","","",""
"60","78","У меня письмо для вас.","I have a letter for you.","I, me, my, mine","I","have, had, has, having, haves, haveta, haveing, have led","have","a, an","a","letter, lettered, lettering, letters, lettera, letter'd","letter","for, on, in, at, since, ago, before, to","for","you, your, yours","you","",".","","","","","",""
"61","78","У меня есть план!","I've got a plan!","I've, I'd, I'll, I'm","I've","got, get, gotten, getting, gets, gettest, geted, gets'","got","a, an","a","plan, planned, plans, planning","plan","","!","","","","","","","","","",""
"62","78","У меня есть кровать.","I've got a bed.","I've, I'd, I'll, I'm","I've","got, get, gotten, getting, gets, gettest, geted, gets'","got","a, an","a","bed, bedding, beds, bedded, beder, bednest","bed","",".","","","","","","","","","",""
"63","78","У меня есть карандаш.","I've got a pencil.","I've, I'd, I'll, I'm","I've","got, get, gotten, getting, gets, gettest, geted, gets'","got","a, an","a","pencil, pencilled, penciled, pencils, pencilling, penciling, pencils'","pencil","",".","","","","","","","","","",""
"64","78","У вас есть дом.","You've got a house.","You've, You'd, You'll, You're","You've","got, get, gotten, getting, gets, gettest, geted, gets'","got","a, an","a","house, housing, houses, housed, hous'd","house","",".","","","","","","","","","",""
"65","78","Я дружелюбный человек.","I'm a friendly person.","I'm, I'd, I'll, I've","I'm","a, an","a","friendly, friendliest, friendlier, friendlies","friendly","person, people, persons, personed, personing","person","",".","","","","","","","","","",""
"66","78","У них интересная работа.","They have an interesting job.","They, Them, Their, Theirs","They","have, had, has, having, haves, haveta, haveing, have led","have","an, a","an","interesting, interests, interested, interestingly, interest","interesting","job, jobber, jobbing, jobs, jobbed","job","",".","","","","","","","",""
"67","78","Ты честный человек.","You are an honest man.","You, Your, Yours","You","are, is, be, been, was, were, will, shall","are","an, a","an","honest, honestest, honests","honest","man, manned, manning, men, maning, mans, maned, maner","man","",".","","","","","","","",""
"68","78","Я богатый человек.","I'm a rich man.","I'm, I'd, I'll, I've","I'm","a, an","a","rich, riches, richest, richer, riched","rich","man, manned, manning, men, maning, mans, maned, maner","man","",".","","","","","","","","","",""
"69","78","Я хороший работник.","I'm a good worker.","I'm, I'd, I'll, I've","I'm","a, an","a","good, best, better, goods, gooding, goodest","good","worker, workers, worked","worker","",".","","","","","","","","","",""
"70","78","У меня есть дом.","I have a home.","I, me, my, mine","I","have, had, has, having, haves, haveta, haveing, have led","have","a, an","a","home, homer, homing, homes, homed, homebed","home","",".","","","","","","","","","",""
"71","78","У меня есть девушка.","I have a girlfriend.","I, me, my, mine","I","have, had, has, having, haves, haveta, haveing, have led","have","a, an","a","girlfriend, girl's, girlhood, girlie, girly, girls, girlish, girl","girlfriend","",".","","","","","","","","","",""
"72","78","У тебя есть сын.","You have a son.","You, Your, Yours","You","have, had, has, having, haves, haveta, haveing, have led","have","a, an","a","son, sons, sonning, soned, sonned, soning","son","",".","","","","","","","","","",""
"73","78","Ты монстр.","You are a monster.","You, Your, Yours","You","are, is, be, been, was, were, will, shall","are","a, an","a","monster, monsters, monstered, monstera","monster","",".","","","","","","","","","",""
"74","78","У нас есть идея.","We have an idea.","We, Our, Us, Ours","We","have, had, has, having, haves, haveta, haveing, have led","have","an, a","an","idea, idealist, idealism, idealize, idealistic, ideally, ideal","idea","",".","","","","","","","","","",""
"75","78","У меня есть ферма.","I have a farm.","I, me, my, mine","I","have, had, has, having, haves, haveta, haveing, have led","have","a, an","a","farm, farming, farms, farmed","farm","",".","","","","","","","","","",""
"76","78","У меня есть лодка.","I have a boat.","I, me, my, mine","I","have, had, has, having, haves, haveta, haveing, have led","have","a, an","a","boat, boating, boats, boated, boatin'","boat","",".","","","","","","","","","",""
"77","78","Я хочу печенье.","I want a cookie.","I, me, my, mine","I","want, won't, wont","want","a, an","a","cookie, cookies, cookies'","cookie","",".","","","","","","","","","",""
"78","78","У нас есть план!","We have a plan!","We, Our, Us, Ours","We","have, had, has, having, haves, haveta, haveing, have led","have","a, an","a","plan, planned, plans, planning","plan","","!","","","","","","","","","",""
"79","78","Мы семья.","We are a family.","We, Our, Us, Ours","We","are, is, be, been, was, were, will, shall","are","a, an","a","family, families, familys, familier","family","",".","","","","","","","","","",""
"80","78","Я ученик.","I am a pupil.","I, me, my, mine","I","am, are, be, been, being, is, was, were","am","a, an","a","pupil, pupils","pupil","",".","","","","","","","","","",""
"81","78","Я хороший учитель.","I'm a good teacher.","I'm, I'd, I'll, I've","I'm","a, an","a","good, best, better, goods, gooding, goodest","good","teacher, teaching, teach","teacher","",".","","","","","","","","","",""
"82","78","Мы счастливая семья.","We are a happy family","We, Our, Us, Ours","We","are, is, be, been, was, were, will, shall","are","a, an","a","happy, happier, happiest, happys, happied, happynest, happying","happy","family, families, familys, familier","family","","","","","","","","","",""
"83","78","Вы хороший танцор!","You are a good dancer!","You, Your, Yours","You","are, is, be, been, was, were, will, shall","are","a, an","a","good, best, better, goods, gooding, goodest","good","dancer, dancing, dancin, dance","dancer","","!","","","","","","","",""
"84","78","Вы знаменитый человек.","You're a famous man.","You're, You'd, You'll, You've","You're","a, an","a","famous, famously","famous","man, manned, manning, men, maning, mans, maned, maner","man","",".","","","","","","","","","",""
"85","78","Ты прекрасный муж.","You're a great husband.","You're, You'd, You'll, You've","You're","a, an","a","great, greater, greats, greatest, greated, greating, greatter, greats'","great","husband, husbands, husbanding, husbanded","husband","",".","","","","","","","","","",""
"86","78","Вы везучий человек!","You're a lucky man!","You're, You'd, You'll, You've","You're","a, an","a","lucky, luckier, luckiest, luckies, luckys","lucky","man, manned, manning, men, maning, mans, maned, maner","man","","!","","","","","","","","","",""
"87","78","Я знаю новую песню.","I know a new song.","I, me, my, mine","I","know, knew, knowing, known, knows, knowed, knowest, knower","know","a, an","a","new, news, newest, newer, newed, newing","new","song, songs, songed, songer","song","",".","","","","","","","",""
"88","78","Ты хорошая мама.","You're a good mum.","You're, You'd, You'll, You've","You're","a, an","a","good, best, better, goods, gooding, goodest","good","mum, mums, mumming, mums', mummed","mum","",".","","","","","","","","","",""
"89","78","Вы другой человек.","You're a different person.","You're, You'd, You'll, You've","You're","a, an","a","different, differentiation, differential, differentiate, differently","different","person, people, persons, personed, personing","person","",".","","","","","","","","","",""
"90","78","У нас маленькая машина.","We have a small car.","We, Our, Us, Ours","We","have, had, has, having, haves, haveta, haveing, have led","have","a, an","a","small, smalls, smaller, smallest, small ta, smalls'","small","car, carer, cars, carring, carred","car","",".","","","","","","","",""
"91","78","Ты чудесный человек.","You're a wonderful person.","You're, You'd, You'll, You've","You're","a, an","a","wonderful, wonderfulest, wonderfuls","wonderful","person, people, persons, personed, personing","person","",".","","","","","","","","","",""
