ID,Page ID,Local text,English text,Mix 1,Correct 1,Mix 2,Correct 2,Mix 3,Correct 3,Mix 4,Correct 4,Mix 5,Correct 5,Mix 6,Correct 6,Mix 7,Correct 7,Mix 8,Correct 8,Mix 9,Correct 9,Mix 10,Correct 10
"173","79","Мы из полиции.","We're from the police.","We're, We'd, We'll, We've","We're","from, in, at, on, by, next to, beside, under","from","the, then, though","the","police, policing, polices, policed","police","",".","","","","","","","","","",""
"174","79","Я сижу на стуле.","I sit on the chair.","I, me, my, mine","I","sit, sat, sitting, sits, sitted, sittest, sit's, sits'","sit","on, in, at, since, for, ago, before, to","on","the, then, though","the","chair, chairs, chaired, chairing","chair","",".","","","","","","","",""
"175","79","Вы в библиотеке.","You're in the library.","You're, You'd, You'll, You've","You're","in, on, at, since, for, ago, before, to","in","the, then, though","the","library, libraries, librarys","library","",".","","","","","","","","","",""
"176","79","Мы в парке.","We are in the park.","We, Our, Us, Ours","We","are, is, be, been, was, were, will, shall","are","in, on, at, since, for, ago, before, to","in","the, then, though","the","park, parking, parks, parked, parks'","park","",".","","","","","","","",""
"177","79","Я под деревом.","I am under the tree.","I, me, my, mine","I","am, are, be, been, being, is, was, were","am","under, in, at, on, by, next to, beside, below","under","the, then, though","the","tree, trees, treed, treeger, treten, treeing","tree","",".","","","","","","","",""
"178","79","Я играю утром.","I play in the morning.","I, me, my, mine","I","play, playing, played, plays, plaied, plaies, plays'","play","in, on, at, since, for, ago, before, to","in","the, then, though","the","morning, mornin, morn","morning","",".","","","","","","","",""
